date,cfs,y,m,d,j_date,consecutive_date
1/1/1990,7430,1990,1,1,1,1
1/2/1990,11300,1990,1,2,2,2
1/3/1990,15700,1990,1,3,3,3
1/4/1990,15800,1990,1,4,4,4
1/5/1990,12000,1990,1,5,5,5
1/6/1990,14900,1990,1,6,6,6
1/7/1990,8890,1990,1,7,7,7
1/8/1990,12800,1990,1,8,8,8
1/9/1990,11900,1990,1,9,9,9
1/10/1990,12600,1990,1,10,10,10
1/11/1990,11100,1990,1,11,11,11
1/12/1990,12100,1990,1,12,12,12
1/13/1990,9300,1990,1,13,13,13
1/14/1990,6730,1990,1,14,14,14
1/15/1990,10500,1990,1,15,15,15
1/16/1990,14400,1990,1,16,16,16
1/17/1990,12500,1990,1,17,17,17
1/18/1990,15700,1990,1,18,18,18
1/19/1990,14300,1990,1,19,19,19
1/20/1990,12300,1990,1,20,20,20
1/21/1990,6610,1990,1,21,21,21
1/22/1990,13300,1990,1,22,22,22
1/23/1990,12500,1990,1,23,23,23
1/24/1990,11300,1990,1,24,24,24
1/25/1990,8640,1990,1,25,25,25
1/26/1990,8420,1990,1,26,26,26
1/27/1990,9220,1990,1,27,27,27
1/28/1990,6240,1990,1,28,28,28
1/29/1990,9510,1990,1,29,29,29
1/30/1990,11100,1990,1,30,30,30
1/31/1990,8710,1990,1,31,31,31
2/1/1990,9090,1990,2,1,32,32
2/2/1990,11900,1990,2,2,33,33
2/3/1990,8340,1990,2,3,34,34
2/4/1990,6990,1990,2,4,35,35
2/5/1990,9470,1990,2,5,36,36
2/6/1990,9600,1990,2,6,37,37
2/7/1990,9570,1990,2,7,38,38
2/8/1990,11300,1990,2,8,39,39
2/9/1990,11700,1990,2,9,40,40
2/10/1990,6050,1990,2,10,41,41
2/11/1990,4490,1990,2,11,42,42
2/12/1990,7480,1990,2,12,43,43
2/13/1990,8500,1990,2,13,44,44
2/14/1990,14600,1990,2,14,45,45
2/15/1990,15800,1990,2,15,46,46
2/16/1990,13700,1990,2,16,47,47
2/17/1990,9790,1990,2,17,48,48
2/18/1990,8140,1990,2,18,49,49
2/19/1990,9900,1990,2,19,50,50
2/20/1990,13100,1990,2,20,51,51
2/21/1990,13100,1990,2,21,52,52
2/22/1990,11500,1990,2,22,53,53
2/23/1990,11100,1990,2,23,54,54
2/24/1990,9990,1990,2,24,55,55
2/25/1990,7120,1990,2,25,56,56
2/26/1990,12700,1990,2,26,57,57
2/27/1990,16800,1990,2,27,58,58
2/28/1990,17200,1990,2,28,59,59
3/1/1990,15300,1990,3,1,60,60
3/2/1990,12800,1990,3,2,61,61
3/3/1990,9600,1990,3,3,62,62
3/4/1990,8690,1990,3,4,63,63
3/5/1990,14200,1990,3,5,64,64
3/6/1990,16400,1990,3,6,65,65
3/7/1990,12600,1990,3,7,66,66
3/8/1990,10700,1990,3,8,67,67
3/9/1990,10500,1990,3,9,68,68
3/10/1990,5230,1990,3,10,69,69
3/11/1990,4200,1990,3,11,70,70
3/12/1990,8520,1990,3,12,71,71
3/13/1990,10500,1990,3,13,72,72
3/14/1990,12200,1990,3,14,73,73
3/15/1990,11300,1990,3,15,74,74
3/16/1990,10200,1990,3,16,75,75
3/17/1990,8140,1990,3,17,76,76
3/18/1990,3500,1990,3,18,77,77
3/19/1990,10200,1990,3,19,78,78
3/20/1990,11500,1990,3,20,79,79
3/21/1990,9060,1990,3,21,80,80
3/22/1990,11700,1990,3,22,81,81
3/23/1990,16500,1990,3,23,82,82
3/24/1990,6810,1990,3,24,83,83
3/25/1990,4730,1990,3,25,84,84
3/26/1990,7290,1990,3,26,85,85
3/27/1990,9630,1990,3,27,86,86
3/28/1990,12100,1990,3,28,87,87
3/29/1990,14300,1990,3,29,88,88
3/30/1990,14200,1990,3,30,89,89
3/31/1990,10200,1990,3,31,90,90
4/1/1990,5920,1990,4,1,91,91
4/2/1990,9390,1990,4,2,92,92
4/3/1990,9820,1990,4,3,93,93
4/4/1990,10100,1990,4,4,94,94
4/5/1990,10600,1990,4,5,95,95
4/6/1990,8750,1990,4,6,96,96
4/7/1990,6380,1990,4,7,97,97
4/8/1990,5020,1990,4,8,98,98
4/9/1990,9060,1990,4,9,99,99
4/10/1990,11600,1990,4,10,100,100
4/11/1990,14800,1990,4,11,101,101
4/12/1990,15000,1990,4,12,102,102
4/13/1990,11000,1990,4,13,103,103
4/14/1990,7910,1990,4,14,104,104
4/15/1990,7590,1990,4,15,105,105
4/16/1990,12400,1990,4,16,106,106
4/17/1990,14000,1990,4,17,107,107
4/18/1990,10700,1990,4,18,108,108
4/19/1990,11000,1990,4,19,109,109
4/20/1990,10800,1990,4,20,110,110
4/21/1990,8390,1990,4,21,111,111
4/22/1990,5750,1990,4,22,112,112
4/23/1990,8090,1990,4,23,113,113
4/24/1990,9530,1990,4,24,114,114
4/25/1990,10700,1990,4,25,115,115
4/26/1990,10100,1990,4,26,116,116
4/27/1990,10100,1990,4,27,117,117
4/28/1990,10100,1990,4,28,118,118
4/29/1990,9860,1990,4,29,119,119
4/30/1990,10800,1990,4,30,120,120
5/1/1990,9210,1990,5,1,121,121
5/2/1990,10600,1990,5,2,122,122
5/3/1990,8960,1990,5,3,123,123
5/4/1990,9560,1990,5,4,124,124
5/5/1990,8700,1990,5,5,125,125
5/6/1990,9760,1990,5,6,126,126
5/7/1990,15000,1990,5,7,127,127
5/8/1990,12100,1990,5,8,128,128
5/9/1990,11100,1990,5,9,129,129
5/10/1990,12700,1990,5,10,130,130
5/11/1990,11700,1990,5,11,131,131
5/12/1990,10300,1990,5,12,132,132
5/13/1990,6770,1990,5,13,133,133
5/14/1990,11300,1990,5,14,134,134
5/15/1990,12000,1990,5,15,135,135
5/16/1990,12300,1990,5,16,136,136
5/17/1990,13000,1990,5,17,137,137
5/18/1990,11000,1990,5,18,138,138
5/19/1990,5990,1990,5,19,139,139
5/20/1990,4020,1990,5,20,140,140
5/21/1990,8100,1990,5,21,141,141
5/22/1990,10600,1990,5,22,142,142
5/23/1990,13200,1990,5,23,143,143
5/24/1990,14100,1990,5,24,144,144
5/25/1990,11600,1990,5,25,145,145
5/26/1990,8900,1990,5,26,146,146
5/27/1990,5970,1990,5,27,147,147
5/28/1990,8050,1990,5,28,148,148
5/29/1990,9560,1990,5,29,149,149
5/30/1990,10500,1990,5,30,150,150
5/31/1990,10600,1990,5,31,151,151
6/1/1990,5710,1990,6,1,152,152
6/2/1990,4850,1990,6,2,153,153
6/3/1990,4850,1990,6,3,154,154
6/4/1990,4860,1990,6,4,155,155
6/5/1990,13200,1990,6,5,156,156
6/6/1990,12400,1990,6,6,157,157
6/7/1990,14200,1990,6,7,158,158
6/8/1990,15000,1990,6,8,159,159
6/9/1990,9630,1990,6,9,160,160
6/10/1990,9510,1990,6,10,161,161
6/11/1990,13700,1990,6,11,162,162
6/12/1990,14000,1990,6,12,163,163
6/13/1990,15000,1990,6,13,164,164
6/14/1990,14100,1990,6,14,165,165
6/15/1990,14800,1990,6,15,166,166
6/16/1990,10000,1990,6,16,167,167
6/17/1990,9920,1990,6,17,168,168
6/18/1990,17000,1990,6,18,169,169
6/19/1990,17600,1990,6,19,170,170
6/20/1990,16400,1990,6,20,171,171
6/21/1990,16500,1990,6,21,172,172
6/22/1990,17400,1990,6,22,173,173
6/23/1990,17400,1990,6,23,174,174
6/24/1990,14500,1990,6,24,175,175
6/25/1990,12300,1990,6,25,176,176
6/26/1990,20000,1990,6,26,177,177
6/27/1990,17500,1990,6,27,178,178
6/28/1990,15300,1990,6,28,179,179
6/29/1990,6250,1990,6,29,180,180
6/30/1990,4810,1990,6,30,181,181
7/1/1990,4810,1990,7,1,182,182
7/2/1990,14100,1990,7,2,183,183
7/3/1990,14900,1990,7,3,184,184
7/4/1990,14900,1990,7,4,185,185
7/5/1990,14900,1990,7,5,186,186
7/6/1990,14900,1990,7,6,187,187
7/7/1990,14900,1990,7,7,188,188
7/8/1990,14900,1990,7,8,189,189
7/9/1990,14900,1990,7,9,190,190
7/10/1990,14900,1990,7,10,191,191
7/11/1990,14900,1990,7,11,192,192
7/12/1990,14900,1990,7,12,193,193
7/13/1990,5590,1990,7,13,194,194
7/14/1990,4790,1990,7,14,195,195
7/15/1990,4780,1990,7,15,196,196
7/16/1990,14600,1990,7,16,197,197
7/17/1990,15300,1990,7,17,198,198
7/18/1990,15300,1990,7,18,199,199
7/19/1990,15300,1990,7,19,200,200
7/20/1990,15400,1990,7,20,201,201
7/21/1990,15400,1990,7,21,202,202
7/22/1990,15400,1990,7,22,203,203
7/23/1990,15400,1990,7,23,204,204
7/24/1990,15400,1990,7,24,205,205
7/25/1990,15400,1990,7,25,206,206
7/26/1990,15400,1990,7,26,207,207
7/27/1990,5500,1990,7,27,208,208
7/28/1990,4820,1990,7,28,209,209
7/29/1990,4760,1990,7,29,210,210
7/30/1990,14800,1990,7,30,211,211
7/31/1990,17800,1990,7,31,212,212
8/1/1990,16500,1990,8,1,213,213
8/2/1990,15800,1990,8,2,214,214
8/3/1990,16500,1990,8,3,215,215
8/4/1990,13600,1990,8,4,216,216
8/5/1990,12300,1990,8,5,217,217
8/6/1990,16900,1990,8,6,218,218
8/7/1990,17300,1990,8,7,219,219
8/8/1990,17900,1990,8,8,220,220
8/9/1990,18400,1990,8,9,221,221
8/10/1990,18400,1990,8,10,222,222
8/11/1990,14900,1990,8,11,223,223
8/12/1990,10900,1990,8,12,224,224
8/13/1990,16300,1990,8,13,225,225
8/14/1990,16900,1990,8,14,226,226
8/15/1990,14800,1990,8,15,227,227
8/16/1990,17400,1990,8,16,228,228
8/17/1990,17800,1990,8,17,229,229
8/18/1990,13900,1990,8,18,230,230
8/19/1990,10600,1990,8,19,231,231
8/20/1990,16200,1990,8,20,232,232
8/21/1990,18200,1990,8,21,233,233
8/22/1990,17500,1990,8,22,234,234
8/23/1990,18800,1990,8,23,235,235
8/24/1990,18800,1990,8,24,236,236
8/25/1990,13900,1990,8,25,237,237
8/26/1990,8950,1990,8,26,238,238
8/27/1990,15300,1990,8,27,239,239
8/28/1990,17200,1990,8,28,240,240
8/29/1990,17400,1990,8,29,241,241
8/30/1990,15800,1990,8,30,242,242
8/31/1990,15900,1990,8,31,243,243
9/1/1990,13700,1990,9,1,244,244
9/2/1990,8060,1990,9,2,245,245
9/3/1990,8300,1990,9,3,246,246
9/4/1990,13100,1990,9,4,247,247
9/5/1990,14200,1990,9,5,248,248
9/6/1990,16200,1990,9,6,249,249
9/7/1990,17800,1990,9,7,250,250
9/8/1990,15700,1990,9,8,251,251
9/9/1990,12000,1990,9,9,252,252
9/10/1990,14700,1990,9,10,253,253
9/11/1990,12200,1990,9,11,254,254
9/12/1990,12100,1990,9,12,255,255
9/13/1990,12900,1990,9,13,256,256
9/14/1990,6090,1990,9,14,257,257
9/15/1990,4800,1990,9,15,258,258
9/16/1990,4800,1990,9,16,259,259
9/17/1990,14100,1990,9,17,260,260
9/18/1990,14400,1990,9,18,261,261
9/19/1990,14400,1990,9,19,262,262
9/20/1990,14300,1990,9,20,263,263
9/21/1990,14400,1990,9,21,264,264
9/22/1990,14400,1990,9,22,265,265
9/23/1990,14400,1990,9,23,266,266
9/24/1990,14400,1990,9,24,267,267
9/25/1990,14400,1990,9,25,268,268
9/26/1990,14400,1990,9,26,269,269
9/27/1990,14400,1990,9,27,270,270
9/28/1990,5100,1990,9,28,271,271
9/29/1990,4820,1990,9,29,272,272
9/30/1990,4800,1990,9,30,273,273
10/1/1990,8330,1990,10,1,274,274
10/2/1990,8420,1990,10,2,275,275
10/3/1990,8350,1990,10,3,276,276
10/4/1990,8390,1990,10,4,277,277
10/5/1990,8380,1990,10,5,278,278
10/6/1990,8420,1990,10,6,279,279
10/7/1990,8410,1990,10,7,280,280
10/8/1990,8430,1990,10,8,281,281
10/9/1990,8430,1990,10,9,282,282
10/10/1990,8400,1990,10,10,283,283
10/11/1990,8420,1990,10,11,284,284
10/12/1990,5070,1990,10,12,285,285
10/13/1990,4970,1990,10,13,286,286
10/14/1990,4080,1990,10,14,287,287
10/15/1990,7550,1990,10,15,288,288
10/16/1990,7970,1990,10,16,289,289
10/17/1990,7980,1990,10,17,290,290
10/18/1990,8000,1990,10,18,291,291
10/19/1990,8010,1990,10,19,292,292
10/20/1990,7950,1990,10,20,293,293
10/21/1990,7980,1990,10,21,294,294
10/22/1990,8010,1990,10,22,295,295
10/23/1990,8010,1990,10,23,296,296
10/24/1990,8030,1990,10,24,297,297
10/25/1990,8010,1990,10,25,298,298
10/26/1990,5470,1990,10,26,299,299
10/27/1990,5000,1990,10,27,300,300
10/28/1990,5010,1990,10,28,301,301
10/29/1990,6210,1990,10,29,302,302
10/30/1990,7130,1990,10,30,303,303
10/31/1990,6170,1990,10,31,304,304
11/1/1990,8150,1990,11,1,305,305
11/2/1990,6680,1990,11,2,306,306
11/3/1990,6710,1990,11,3,307,307
11/4/1990,3630,1990,11,4,308,308
11/5/1990,7360,1990,11,5,309,309
11/6/1990,7630,1990,11,6,310,310
11/7/1990,8390,1990,11,7,311,311
11/8/1990,10100,1990,11,8,312,312
11/9/1990,5710,1990,11,9,313,313
11/10/1990,5040,1990,11,10,314,314
11/11/1990,5030,1990,11,11,315,315
11/12/1990,7440,1990,11,12,316,316
11/13/1990,9650,1990,11,13,317,317
11/14/1990,10000,1990,11,14,318,318
11/15/1990,10400,1990,11,15,319,319
11/16/1990,11300,1990,11,16,320,320
11/17/1990,8650,1990,11,17,321,321
11/18/1990,5510,1990,11,18,322,322
11/19/1990,11100,1990,11,19,323,323
11/20/1990,10500,1990,11,20,324,324
11/21/1990,12100,1990,11,21,325,325
11/22/1990,8990,1990,11,22,326,326
11/23/1990,8410,1990,11,23,327,327
11/24/1990,7740,1990,11,24,328,328
11/25/1990,6440,1990,11,25,329,329
11/26/1990,10100,1990,11,26,330,330
11/27/1990,11200,1990,11,27,331,331
11/28/1990,9620,1990,11,28,332,332
11/29/1990,9040,1990,11,29,333,333
11/30/1990,7900,1990,11,30,334,334
12/1/1990,8090,1990,12,1,335,335
12/2/1990,6370,1990,12,2,336,336
12/3/1990,10800,1990,12,3,337,337
12/4/1990,10800,1990,12,4,338,338
12/5/1990,10300,1990,12,5,339,339
12/6/1990,10600,1990,12,6,340,340
12/7/1990,11500,1990,12,7,341,341
12/8/1990,8590,1990,12,8,342,342
12/9/1990,6970,1990,12,9,343,343
12/10/1990,11000,1990,12,10,344,344
12/11/1990,11600,1990,12,11,345,345
12/12/1990,11600,1990,12,12,346,346
12/13/1990,11700,1990,12,13,347,347
12/14/1990,6160,1990,12,14,348,348
12/15/1990,4990,1990,12,15,349,349
12/16/1990,4990,1990,12,16,350,350
12/17/1990,9820,1990,12,17,351,351
12/18/1990,10900,1990,12,18,352,352
12/19/1990,10800,1990,12,19,353,353
12/20/1990,10900,1990,12,20,354,354
12/21/1990,10800,1990,12,21,355,355
12/22/1990,10900,1990,12,22,356,356
12/23/1990,10900,1990,12,23,357,357
12/24/1990,10900,1990,12,24,358,358
12/25/1990,10900,1990,12,25,359,359
12/26/1990,10900,1990,12,26,360,360
12/27/1990,10900,1990,12,27,361,361
12/28/1990,5990,1990,12,28,362,362
12/29/1990,4950,1990,12,29,363,363
12/30/1990,4930,1990,12,30,364,364
12/31/1990,13200,1990,12,31,365,365
1/1/1991,14400,1991,1,1,1,366
1/2/1991,14300,1991,1,2,2,367
1/3/1991,14400,1991,1,3,3,368
1/4/1991,14400,1991,1,4,4,369
1/5/1991,14400,1991,1,5,5,370
1/6/1991,14400,1991,1,6,6,371
1/7/1991,14400,1991,1,7,7,372
1/8/1991,14300,1991,1,8,8,373
1/9/1991,14400,1991,1,9,9,374
1/10/1991,14400,1991,1,10,10,375
1/11/1991,6080,1991,1,11,11,376
1/12/1991,4900,1991,1,12,12,377
1/13/1991,4920,1991,1,13,13,378
1/14/1991,10500,1991,1,14,14,379
1/15/1991,10600,1991,1,15,15,380
1/16/1991,10700,1991,1,16,16,381
1/17/1991,11400,1991,1,17,17,382
1/18/1991,12700,1991,1,18,18,383
1/19/1991,9070,1991,1,19,19,384
1/20/1991,8620,1991,1,20,20,385
1/21/1991,10600,1991,1,21,21,386
1/22/1991,11300,1991,1,22,22,387
1/23/1991,14200,1991,1,23,23,388
1/24/1991,15400,1991,1,24,24,389
1/25/1991,6360,1991,1,25,25,390
1/26/1991,4850,1991,1,26,26,391
1/27/1991,4860,1991,1,27,27,392
1/28/1991,9570,1991,1,28,28,393
1/29/1991,10200,1991,1,29,29,394
1/30/1991,10200,1991,1,30,30,395
1/31/1991,10200,1991,1,31,31,396
2/1/1991,10200,1991,2,1,32,397
2/2/1991,10200,1991,2,2,33,398
2/3/1991,10200,1991,2,3,34,399
2/4/1991,10200,1991,2,4,35,400
2/5/1991,10200,1991,2,5,36,401
2/6/1991,10200,1991,2,6,37,402
2/7/1991,10200,1991,2,7,38,403
2/8/1991,5450,1991,2,8,39,404
2/9/1991,4870,1991,2,9,40,405
2/10/1991,4890,1991,2,10,41,406
2/11/1991,10200,1991,2,11,42,407
2/12/1991,13000,1991,2,12,43,408
2/13/1991,12000,1991,2,13,44,409
2/14/1991,12000,1991,2,14,45,410
2/15/1991,12700,1991,2,15,46,411
2/16/1991,11900,1991,2,16,47,412
2/17/1991,10700,1991,2,17,48,413
2/18/1991,14300,1991,2,18,49,414
2/19/1991,16100,1991,2,19,50,415
2/20/1991,15500,1991,2,20,51,416
2/21/1991,13400,1991,2,21,52,417
2/22/1991,13500,1991,2,22,53,418
2/23/1991,11900,1991,2,23,54,419
2/24/1991,7890,1991,2,24,55,420
2/25/1991,11600,1991,2,25,56,421
2/26/1991,9560,1991,2,26,57,422
2/27/1991,7020,1991,2,27,58,423
2/28/1991,7580,1991,2,28,59,424
3/1/1991,10400,1991,3,1,60,425
3/2/1991,8770,1991,3,2,61,426
3/3/1991,5430,1991,3,3,62,427
3/4/1991,9570,1991,3,4,63,428
3/5/1991,9660,1991,3,5,64,429
3/6/1991,10100,1991,3,6,65,430
3/7/1991,10300,1991,3,7,66,431
3/8/1991,9210,1991,3,8,67,432
3/9/1991,8030,1991,3,9,68,433
3/10/1991,4340,1991,3,10,69,434
3/11/1991,10300,1991,3,11,70,435
3/12/1991,11700,1991,3,12,71,436
3/13/1991,10400,1991,3,13,72,437
3/14/1991,11800,1991,3,14,73,438
3/15/1991,12000,1991,3,15,74,439
3/16/1991,9900,1991,3,16,75,440
3/17/1991,6540,1991,3,17,76,441
3/18/1991,11400,1991,3,18,77,442
3/19/1991,10900,1991,3,19,78,443
3/20/1991,10900,1991,3,20,79,444
3/21/1991,12100,1991,3,21,80,445
3/22/1991,11300,1991,3,22,81,446
3/23/1991,10900,1991,3,23,82,447
3/24/1991,6680,1991,3,24,83,448
3/25/1991,12300,1991,3,25,84,449
3/26/1991,13500,1991,3,26,85,450
3/27/1991,11800,1991,3,27,86,451
3/28/1991,10500,1991,3,28,87,452
3/29/1991,7140,1991,3,29,88,453
3/30/1991,5160,1991,3,30,89,454
3/31/1991,4610,1991,3,31,90,455
4/1/1991,9940,1991,4,1,91,456
4/2/1991,12200,1991,4,2,92,457
4/3/1991,10500,1991,4,3,93,458
4/4/1991,10900,1991,4,4,94,459
4/5/1991,8470,1991,4,5,95,460
4/6/1991,9640,1991,4,6,96,461
4/7/1991,7330,1991,4,7,97,462
4/8/1991,9330,1991,4,8,98,463
4/9/1991,10900,1991,4,9,99,464
4/10/1991,11100,1991,4,10,100,465
4/11/1991,13500,1991,4,11,101,466
4/12/1991,12300,1991,4,12,102,467
4/13/1991,10400,1991,4,13,103,468
4/14/1991,7270,1991,4,14,104,469
4/15/1991,10600,1991,4,15,105,470
4/16/1991,8810,1991,4,16,106,471
4/17/1991,9590,1991,4,17,107,472
4/18/1991,10200,1991,4,18,108,473
4/19/1991,5680,1991,4,19,109,474
4/20/1991,5120,1991,4,20,110,475
4/21/1991,5130,1991,4,21,111,476
4/22/1991,8890,1991,4,22,112,477
4/23/1991,10300,1991,4,23,113,478
4/24/1991,8830,1991,4,24,114,479
4/25/1991,11600,1991,4,25,115,480
4/26/1991,8330,1991,4,26,116,481
4/27/1991,5920,1991,4,27,117,482
4/28/1991,4270,1991,4,28,118,483
4/29/1991,9660,1991,4,29,119,484
4/30/1991,13300,1991,4,30,120,485
5/1/1991,9840,1991,5,1,121,486
5/2/1991,9200,1991,5,2,122,487
5/3/1991,5790,1991,5,3,123,488
5/4/1991,5180,1991,5,4,124,489
5/5/1991,5390,1991,5,5,125,490
5/6/1991,14700,1991,5,6,126,491
5/7/1991,15200,1991,5,7,127,492
5/8/1991,15200,1991,5,8,128,493
5/9/1991,15200,1991,5,9,129,494
5/10/1991,15200,1991,5,10,130,495
5/11/1991,15200,1991,5,11,131,496
5/12/1991,15200,1991,5,12,132,497
5/13/1991,15200,1991,5,13,133,498
5/14/1991,15200,1991,5,14,134,499
5/15/1991,15200,1991,5,15,135,500
5/16/1991,15200,1991,5,16,136,501
5/17/1991,5300,1991,5,17,137,502
5/18/1991,5090,1991,5,18,138,503
5/19/1991,5090,1991,5,19,139,504
5/20/1991,13800,1991,5,20,140,505
5/21/1991,15000,1991,5,21,141,506
5/22/1991,15000,1991,5,22,142,507
5/23/1991,15000,1991,5,23,143,508
5/24/1991,15000,1991,5,24,144,509
5/25/1991,15000,1991,5,25,145,510
5/26/1991,15000,1991,5,26,146,511
5/27/1991,15000,1991,5,27,147,512
5/28/1991,15000,1991,5,28,148,513
5/29/1991,15000,1991,5,29,149,514
5/30/1991,15000,1991,5,30,150,515
5/31/1991,6310,1991,5,31,151,516
6/1/1991,4950,1991,6,1,152,517
6/2/1991,5050,1991,6,2,153,518
6/3/1991,12000,1991,6,3,154,519
6/4/1991,10000,1991,6,4,155,520
6/5/1991,12300,1991,6,5,156,521
6/6/1991,12400,1991,6,6,157,522
6/7/1991,15300,1991,6,7,158,523
6/8/1991,12000,1991,6,8,159,524
6/9/1991,10400,1991,6,9,160,525
6/10/1991,16600,1991,6,10,161,526
6/11/1991,16600,1991,6,11,162,527
6/12/1991,17100,1991,6,12,163,528
6/13/1991,17000,1991,6,13,164,529
6/14/1991,17100,1991,6,14,165,530
6/15/1991,11500,1991,6,15,166,531
6/16/1991,12300,1991,6,16,167,532
6/17/1991,19600,1991,6,17,168,533
6/18/1991,19300,1991,6,18,169,534
6/19/1991,19300,1991,6,19,170,535
6/20/1991,18600,1991,6,20,171,536
6/21/1991,17400,1991,6,21,172,537
6/22/1991,14300,1991,6,22,173,538
6/23/1991,9150,1991,6,23,174,539
6/24/1991,14600,1991,6,24,175,540
6/25/1991,17400,1991,6,25,176,541
6/26/1991,17100,1991,6,26,177,542
6/27/1991,17200,1991,6,27,178,543
6/28/1991,6280,1991,6,28,179,544
6/29/1991,5020,1991,6,29,180,545
6/30/1991,5010,1991,6,30,181,546
7/1/1991,17300,1991,7,1,182,547
7/2/1991,18200,1991,7,2,183,548
7/3/1991,18300,1991,7,3,184,549
7/4/1991,18300,1991,7,4,185,550
7/5/1991,18300,1991,7,5,186,551
7/6/1991,18300,1991,7,6,187,552
7/7/1991,18300,1991,7,7,188,553
7/8/1991,18300,1991,7,8,189,554
7/9/1991,18300,1991,7,9,190,555
7/10/1991,18300,1991,7,10,191,556
7/11/1991,18300,1991,7,11,192,557
7/12/1991,5910,1991,7,12,193,558
7/13/1991,5010,1991,7,13,194,559
7/14/1991,5010,1991,7,14,195,560
7/15/1991,16100,1991,7,15,196,561
7/16/1991,17000,1991,7,16,197,562
7/17/1991,17000,1991,7,17,198,563
7/18/1991,17000,1991,7,18,199,564
7/19/1991,17000,1991,7,19,200,565
7/20/1991,17000,1991,7,20,201,566
7/21/1991,17000,1991,7,21,202,567
7/22/1991,17000,1991,7,22,203,568
7/23/1991,17100,1991,7,23,204,569
7/24/1991,17000,1991,7,24,205,570
7/25/1991,17000,1991,7,25,206,571
7/26/1991,5860,1991,7,26,207,572
7/27/1991,4980,1991,7,27,208,573
7/28/1991,4980,1991,7,28,209,574
7/29/1991,14400,1991,7,29,210,575
7/30/1991,17600,1991,7,30,211,576
7/31/1991,18000,1991,7,31,212,577
8/1/1991,14900,1991,8,1,213,578
8/2/1991,14300,1991,8,2,214,579
8/3/1991,14100,1991,8,3,215,580
8/4/1991,13900,1991,8,4,216,581
8/5/1991,14500,1991,8,5,217,582
8/6/1991,14400,1991,8,6,218,583
8/7/1991,14500,1991,8,7,219,584
8/8/1991,14700,1991,8,8,220,585
8/9/1991,14500,1991,8,9,221,586
8/10/1991,13900,1991,8,10,222,587
8/11/1991,13900,1991,8,11,223,588
8/12/1991,14500,1991,8,12,224,589
8/13/1991,14900,1991,8,13,225,590
8/14/1991,14900,1991,8,14,226,591
8/15/1991,14900,1991,8,15,227,592
8/16/1991,14900,1991,8,16,228,593
8/17/1991,14500,1991,8,17,229,594
8/18/1991,12400,1991,8,18,230,595
8/19/1991,14900,1991,8,19,231,596
8/20/1991,14900,1991,8,20,232,597
8/21/1991,15100,1991,8,21,233,598
8/22/1991,15000,1991,8,22,234,599
8/23/1991,14900,1991,8,23,235,600
8/24/1991,14700,1991,8,24,236,601
8/25/1991,10600,1991,8,25,237,602
8/26/1991,14800,1991,8,26,238,603
8/27/1991,15000,1991,8,27,239,604
8/28/1991,15000,1991,8,28,240,605
8/29/1991,15000,1991,8,29,241,606
8/30/1991,14900,1991,8,30,242,607
8/31/1991,14600,1991,8,31,243,608
9/1/1991,9830,1991,9,1,244,609
9/2/1991,9240,1991,9,2,245,610
9/3/1991,14100,1991,9,3,246,611
9/4/1991,14500,1991,9,4,247,612
9/5/1991,14500,1991,9,5,248,613
9/6/1991,14600,1991,9,6,249,614
9/7/1991,13200,1991,9,7,250,615
9/8/1991,9240,1991,9,8,251,616
9/9/1991,14000,1991,9,9,252,617
9/10/1991,14300,1991,9,10,253,618
9/11/1991,14000,1991,9,11,254,619
9/12/1991,14200,1991,9,12,255,620
9/13/1991,14300,1991,9,13,256,621
9/14/1991,13300,1991,9,14,257,622
9/15/1991,9240,1991,9,15,258,623
9/16/1991,14200,1991,9,16,259,624
9/17/1991,14500,1991,9,17,260,625
9/18/1991,14100,1991,9,18,261,626
9/19/1991,14100,1991,9,19,262,627
9/20/1991,14400,1991,9,20,263,628
9/21/1991,13700,1991,9,21,264,629
9/22/1991,9910,1991,9,22,265,630
9/23/1991,14200,1991,9,23,266,631
9/24/1991,14900,1991,9,24,267,632
9/25/1991,15000,1991,9,25,268,633
9/26/1991,14700,1991,9,26,269,634
9/27/1991,15000,1991,9,27,270,635
9/28/1991,14600,1991,9,28,271,636
9/29/1991,9980,1991,9,29,272,637
9/30/1991,12600,1991,9,30,273,638
10/1/1991,9430,1991,10,1,274,639
10/2/1991,9250,1991,10,2,275,640
10/3/1991,9050,1991,10,3,276,641
10/4/1991,9310,1991,10,4,277,642
10/5/1991,7330,1991,10,5,278,643
10/6/1991,7550,1991,10,6,279,644
10/7/1991,9300,1991,10,7,280,645
10/8/1991,9160,1991,10,8,281,646
10/9/1991,9330,1991,10,9,282,647
10/10/1991,9300,1991,10,10,283,648
10/11/1991,9200,1991,10,11,284,649
10/12/1991,7610,1991,10,12,285,650
10/13/1991,7670,1991,10,13,286,651
10/14/1991,8960,1991,10,14,287,652
10/15/1991,9130,1991,10,15,288,653
10/16/1991,9000,1991,10,16,289,654
10/17/1991,9950,1991,10,17,290,655
10/18/1991,9070,1991,10,18,291,656
10/19/1991,8040,1991,10,19,292,657
10/20/1991,7750,1991,10,20,293,658
10/21/1991,8780,1991,10,21,294,659
10/22/1991,9270,1991,10,22,295,660
10/23/1991,8910,1991,10,23,296,661
10/24/1991,8940,1991,10,24,297,662
10/25/1991,8630,1991,10,25,298,663
10/26/1991,8630,1991,10,26,299,664
10/27/1991,7790,1991,10,27,300,665
10/28/1991,8550,1991,10,28,301,666
10/29/1991,8630,1991,10,29,302,667
10/30/1991,9170,1991,10,30,303,668
10/31/1991,9370,1991,10,31,304,669
11/1/1991,9700,1991,11,1,305,670
11/2/1991,9520,1991,11,2,306,671
11/3/1991,8470,1991,11,3,307,672
11/4/1991,9980,1991,11,4,308,673
11/5/1991,10100,1991,11,5,309,674
11/6/1991,10000,1991,11,6,310,675
11/7/1991,9950,1991,11,7,311,676
11/8/1991,10100,1991,11,8,312,677
11/9/1991,9180,1991,11,9,313,678
11/10/1991,8310,1991,11,10,314,679
11/11/1991,9680,1991,11,11,315,680
11/12/1991,10100,1991,11,12,316,681
11/13/1991,10200,1991,11,13,317,682
11/14/1991,10100,1991,11,14,318,683
11/15/1991,10300,1991,11,15,319,684
11/16/1991,9530,1991,11,16,320,685
11/17/1991,8350,1991,11,17,321,686
11/18/1991,10100,1991,11,18,322,687
11/19/1991,10300,1991,11,19,323,688
11/20/1991,10100,1991,11,20,324,689
11/21/1991,10100,1991,11,21,325,690
11/22/1991,10100,1991,11,22,326,691
11/23/1991,9400,1991,11,23,327,692
11/24/1991,8610,1991,11,24,328,693
11/25/1991,10000,1991,11,25,329,694
11/26/1991,10100,1991,11,26,330,695
11/27/1991,10100,1991,11,27,331,696
11/28/1991,8720,1991,11,28,332,697
11/29/1991,9960,1991,11,29,333,698
11/30/1991,9420,1991,11,30,334,699
12/1/1991,9410,1991,12,1,335,700
12/2/1991,11300,1991,12,2,336,701
12/3/1991,11500,1991,12,3,337,702
12/4/1991,11500,1991,12,4,338,703
12/5/1991,11500,1991,12,5,339,704
12/6/1991,11500,1991,12,6,340,705
12/7/1991,10800,1991,12,7,341,706
12/8/1991,9730,1991,12,8,342,707
12/9/1991,11200,1991,12,9,343,708
12/10/1991,11500,1991,12,10,344,709
12/11/1991,11500,1991,12,11,345,710
12/12/1991,11500,1991,12,12,346,711
12/13/1991,11600,1991,12,13,347,712
12/14/1991,10800,1991,12,14,348,713
12/15/1991,9580,1991,12,15,349,714
12/16/1991,11300,1991,12,16,350,715
12/17/1991,11400,1991,12,17,351,716
12/18/1991,11600,1991,12,18,352,717
12/19/1991,11600,1991,12,19,353,718
12/20/1991,11700,1991,12,20,354,719
12/21/1991,11100,1991,12,21,355,720
12/22/1991,9900,1991,12,22,356,721
12/23/1991,11300,1991,12,23,357,722
12/24/1991,11600,1991,12,24,358,723
12/25/1991,9700,1991,12,25,359,724
12/26/1991,11400,1991,12,26,360,725
12/27/1991,11600,1991,12,27,361,726
12/28/1991,11100,1991,12,28,362,727
12/29/1991,9790,1991,12,29,363,728
12/30/1991,11400,1991,12,30,364,729
12/31/1991,11700,1991,12,31,365,730
1/1/1992,9920,1992,1,1,1,731
1/2/1992,13100,1992,1,2,2,732
1/3/1992,13400,1992,1,3,3,733
1/4/1992,12000,1992,1,4,4,734
1/5/1992,9970,1992,1,5,5,735
1/6/1992,13000,1992,1,6,6,736
1/7/1992,13400,1992,1,7,7,737
1/8/1992,13300,1992,1,8,8,738
1/9/1992,13500,1992,1,9,9,739
1/10/1992,13500,1992,1,10,10,740
1/11/1992,12800,1992,1,11,11,741
1/12/1992,10600,1992,1,12,12,742
1/13/1992,13200,1992,1,13,13,743
1/14/1992,13400,1992,1,14,14,744
1/15/1992,13500,1992,1,15,15,745
1/16/1992,13400,1992,1,16,16,746
1/17/1992,13500,1992,1,17,17,747
1/18/1992,12800,1992,1,18,18,748
1/19/1992,10800,1992,1,19,19,749
1/20/1992,13600,1992,1,20,20,750
1/21/1992,14000,1992,1,21,21,751
1/22/1992,14100,1992,1,22,22,752
1/23/1992,14400,1992,1,23,23,753
1/24/1992,13700,1992,1,24,24,754
1/25/1992,13000,1992,1,25,25,755
1/26/1992,10800,1992,1,26,26,756
1/27/1992,13000,1992,1,27,27,757
1/28/1992,13000,1992,1,28,28,758
1/29/1992,12700,1992,1,29,29,759
1/30/1992,12400,1992,1,30,30,760
1/31/1992,11800,1992,1,31,31,761
2/1/1992,10800,1992,2,1,32,762
2/2/1992,8990,1992,2,2,33,763
2/3/1992,11600,1992,2,3,34,764
2/4/1992,11800,1992,2,4,35,765
2/5/1992,11700,1992,2,5,36,766
2/6/1992,11800,1992,2,6,37,767
2/7/1992,11800,1992,2,7,38,768
2/8/1992,10900,1992,2,8,39,769
2/9/1992,9150,1992,2,9,40,770
2/10/1992,11400,1992,2,10,41,771
2/11/1992,11700,1992,2,11,42,772
2/12/1992,11900,1992,2,12,43,773
2/13/1992,12000,1992,2,13,44,774
2/14/1992,11900,1992,2,14,45,775
2/15/1992,11000,1992,2,15,46,776
2/16/1992,9110,1992,2,16,47,777
2/17/1992,11600,1992,2,17,48,778
2/18/1992,11800,1992,2,18,49,779
2/19/1992,11700,1992,2,19,50,780
2/20/1992,11700,1992,2,20,51,781
2/21/1992,11700,1992,2,21,52,782
2/22/1992,11000,1992,2,22,53,783
2/23/1992,9030,1992,2,23,54,784
2/24/1992,11300,1992,2,24,55,785
2/25/1992,11700,1992,2,25,56,786
2/26/1992,11700,1992,2,26,57,787
2/27/1992,10900,1992,2,27,58,788
2/28/1992,10700,1992,2,28,59,789
2/29/1992,9810,1992,2,29,60,790
3/1/1992,8820,1992,3,1,61,791
3/2/1992,9910,1992,3,2,62,792
3/3/1992,10200,1992,3,3,63,793
3/4/1992,9930,1992,3,4,64,794
3/5/1992,9730,1992,3,5,65,795
3/6/1992,9660,1992,3,6,66,796
3/7/1992,9430,1992,3,7,67,797
3/8/1992,8940,1992,3,8,68,798
3/9/1992,10200,1992,3,9,69,799
3/10/1992,10300,1992,3,10,70,800
3/11/1992,9780,1992,3,11,71,801
3/12/1992,10200,1992,3,12,72,802
3/13/1992,10000,1992,3,13,73,803
3/14/1992,9460,1992,3,14,74,804
3/15/1992,8740,1992,3,15,75,805
3/16/1992,10200,1992,3,16,76,806
3/17/1992,10500,1992,3,17,77,807
3/18/1992,10300,1992,3,18,78,808
3/19/1992,10200,1992,3,19,79,809
3/20/1992,10200,1992,3,20,80,810
3/21/1992,9470,1992,3,21,81,811
3/22/1992,8700,1992,3,22,82,812
3/23/1992,10100,1992,3,23,83,813
3/24/1992,9900,1992,3,24,84,814
3/25/1992,10100,1992,3,25,85,815
3/26/1992,9770,1992,3,26,86,816
3/27/1992,9610,1992,3,27,87,817
3/28/1992,9110,1992,3,28,88,818
3/29/1992,8280,1992,3,29,89,819
3/30/1992,9050,1992,3,30,90,820
3/31/1992,8350,1992,3,31,91,821
4/1/1992,9750,1992,4,1,92,822
4/2/1992,10100,1992,4,2,93,823
4/3/1992,9990,1992,4,3,94,824
4/4/1992,9830,1992,4,4,95,825
4/5/1992,8300,1992,4,5,96,826
4/6/1992,9940,1992,4,6,97,827
4/7/1992,10100,1992,4,7,98,828
4/8/1992,10100,1992,4,8,99,829
4/9/1992,10300,1992,4,9,100,830
4/10/1992,10500,1992,4,10,101,831
4/11/1992,10100,1992,4,11,102,832
4/12/1992,8180,1992,4,12,103,833
4/13/1992,9990,1992,4,13,104,834
4/14/1992,10200,1992,4,14,105,835
4/15/1992,10100,1992,4,15,106,836
4/16/1992,9980,1992,4,16,107,837
4/17/1992,9970,1992,4,17,108,838
4/18/1992,9130,1992,4,18,109,839
4/19/1992,7840,1992,4,19,110,840
4/20/1992,9890,1992,4,20,111,841
4/21/1992,10400,1992,4,21,112,842
4/22/1992,10300,1992,4,22,113,843
4/23/1992,10400,1992,4,23,114,844
4/24/1992,10200,1992,4,24,115,845
4/25/1992,8440,1992,4,25,116,846
4/26/1992,6910,1992,4,26,117,847
4/27/1992,9110,1992,4,27,118,848
4/28/1992,9150,1992,4,28,119,849
4/29/1992,9090,1992,4,29,120,850
4/30/1992,9420,1992,4,30,121,851
5/1/1992,10200,1992,5,1,122,852
5/2/1992,9380,1992,5,2,123,853
5/3/1992,8380,1992,5,3,124,854
5/4/1992,10400,1992,5,4,125,855
5/5/1992,10500,1992,5,5,126,856
5/6/1992,10500,1992,5,6,127,857
5/7/1992,10400,1992,5,7,128,858
5/8/1992,10500,1992,5,8,129,859
5/9/1992,9500,1992,5,9,130,860
5/10/1992,8720,1992,5,10,131,861
5/11/1992,9980,1992,5,11,132,862
5/12/1992,10400,1992,5,12,133,863
5/13/1992,10600,1992,5,13,134,864
5/14/1992,10400,1992,5,14,135,865
5/15/1992,10300,1992,5,15,136,866
5/16/1992,9590,1992,5,16,137,867
5/17/1992,8500,1992,5,17,138,868
5/18/1992,10100,1992,5,18,139,869
5/19/1992,10200,1992,5,19,140,870
5/20/1992,10000,1992,5,20,141,871
5/21/1992,9890,1992,5,21,142,872
5/22/1992,9920,1992,5,22,143,873
5/23/1992,9110,1992,5,23,144,874
5/24/1992,8280,1992,5,24,145,875
5/25/1992,8090,1992,5,25,146,876
5/26/1992,9480,1992,5,26,147,877
5/27/1992,9530,1992,5,27,148,878
5/28/1992,9230,1992,5,28,149,879
5/29/1992,8890,1992,5,29,150,880
5/30/1992,7320,1992,5,30,151,881
5/31/1992,6310,1992,5,31,152,882
6/1/1992,9650,1992,6,1,153,883
6/2/1992,11400,1992,6,2,154,884
6/3/1992,11700,1992,6,3,155,885
6/4/1992,11600,1992,6,4,156,886
6/5/1992,11500,1992,6,5,157,887
6/6/1992,10700,1992,6,6,158,888
6/7/1992,8830,1992,6,7,159,889
6/8/1992,11000,1992,6,8,160,890
6/9/1992,10800,1992,6,9,161,891
6/10/1992,11500,1992,6,10,162,892
6/11/1992,11600,1992,6,11,163,893
6/12/1992,11500,1992,6,12,164,894
6/13/1992,10200,1992,6,13,165,895
6/14/1992,8420,1992,6,14,166,896
6/15/1992,11200,1992,6,15,167,897
6/16/1992,11300,1992,6,16,168,898
6/17/1992,11100,1992,6,17,169,899
6/18/1992,11300,1992,6,18,170,900
6/19/1992,11400,1992,6,19,171,901
6/20/1992,10500,1992,6,20,172,902
6/21/1992,8560,1992,6,21,173,903
6/22/1992,11500,1992,6,22,174,904
6/23/1992,12100,1992,6,23,175,905
6/24/1992,11900,1992,6,24,176,906
6/25/1992,12000,1992,6,25,177,907
6/26/1992,11700,1992,6,26,178,908
6/27/1992,12300,1992,6,27,179,909
6/28/1992,10800,1992,6,28,180,910
6/29/1992,12700,1992,6,29,181,911
6/30/1992,13400,1992,6,30,182,912
7/1/1992,14600,1992,7,1,183,913
7/2/1992,14800,1992,7,2,184,914
7/3/1992,11800,1992,7,3,185,915
7/4/1992,10700,1992,7,4,186,916
7/5/1992,10800,1992,7,5,187,917
7/6/1992,14500,1992,7,6,188,918
7/7/1992,14700,1992,7,7,189,919
7/8/1992,15100,1992,7,8,190,920
7/9/1992,14900,1992,7,9,191,921
7/10/1992,15000,1992,7,10,192,922
7/11/1992,14700,1992,7,11,193,923
7/12/1992,12800,1992,7,12,194,924
7/13/1992,14600,1992,7,13,195,925
7/14/1992,14200,1992,7,14,196,926
7/15/1992,14500,1992,7,15,197,927
7/16/1992,14400,1992,7,16,198,928
7/17/1992,14700,1992,7,17,199,929
7/18/1992,14000,1992,7,18,200,930
7/19/1992,10500,1992,7,19,201,931
7/20/1992,14300,1992,7,20,202,932
7/21/1992,14500,1992,7,21,203,933
7/22/1992,14600,1992,7,22,204,934
7/23/1992,14700,1992,7,23,205,935
7/24/1992,14300,1992,7,24,206,936
7/25/1992,13100,1992,7,25,207,937
7/26/1992,10100,1992,7,26,208,938
7/27/1992,13700,1992,7,27,209,939
7/28/1992,14100,1992,7,28,210,940
7/29/1992,14500,1992,7,29,211,941
7/30/1992,14600,1992,7,30,212,942
7/31/1992,14100,1992,7,31,213,943
8/1/1992,14600,1992,8,1,214,944
8/2/1992,11600,1992,8,2,215,945
8/3/1992,14700,1992,8,3,216,946
8/4/1992,15000,1992,8,4,217,947
8/5/1992,14600,1992,8,5,218,948
8/6/1992,14700,1992,8,6,219,949
8/7/1992,14600,1992,8,7,220,950
8/8/1992,14000,1992,8,8,221,951
8/9/1992,11200,1992,8,9,222,952
8/10/1992,14500,1992,8,10,223,953
8/11/1992,14700,1992,8,11,224,954
8/12/1992,14900,1992,8,12,225,955
8/13/1992,14700,1992,8,13,226,956
8/14/1992,15100,1992,8,14,227,957
8/15/1992,14600,1992,8,15,228,958
8/16/1992,12200,1992,8,16,229,959
8/17/1992,14700,1992,8,17,230,960
8/18/1992,14900,1992,8,18,231,961
8/19/1992,14700,1992,8,19,232,962
8/20/1992,14400,1992,8,20,233,963
8/21/1992,14100,1992,8,21,234,964
8/22/1992,13200,1992,8,22,235,965
8/23/1992,11000,1992,8,23,236,966
8/24/1992,12900,1992,8,24,237,967
8/25/1992,12100,1992,8,25,238,968
8/26/1992,12800,1992,8,26,239,969
8/27/1992,12800,1992,8,27,240,970
8/28/1992,12600,1992,8,28,241,971
8/29/1992,13200,1992,8,29,242,972
8/30/1992,11100,1992,8,30,243,973
8/31/1992,12600,1992,8,31,244,974
9/1/1992,12500,1992,9,1,245,975
9/2/1992,12700,1992,9,2,246,976
9/3/1992,12300,1992,9,3,247,977
9/4/1992,12200,1992,9,4,248,978
9/5/1992,10400,1992,9,5,249,979
9/6/1992,8970,1992,9,6,250,980
9/7/1992,9850,1992,9,7,251,981
9/8/1992,12300,1992,9,8,252,982
9/9/1992,12700,1992,9,9,253,983
9/10/1992,13000,1992,9,10,254,984
9/11/1992,13000,1992,9,11,255,985
9/12/1992,11200,1992,9,12,256,986
9/13/1992,9360,1992,9,13,257,987
9/14/1992,12100,1992,9,14,258,988
9/15/1992,11900,1992,9,15,259,989
9/16/1992,12500,1992,9,16,260,990
9/17/1992,12200,1992,9,17,261,991
9/18/1992,12000,1992,9,18,262,992
9/19/1992,10900,1992,9,19,263,993
9/20/1992,9480,1992,9,20,264,994
9/21/1992,11500,1992,9,21,265,995
9/22/1992,12200,1992,9,22,266,996
9/23/1992,12100,1992,9,23,267,997
9/24/1992,12100,1992,9,24,268,998
9/25/1992,11900,1992,9,25,269,999
9/26/1992,10300,1992,9,26,270,1000
9/27/1992,9290,1992,9,27,271,1001
9/28/1992,11300,1992,9,28,272,1002
9/29/1992,11100,1992,9,29,273,1003
9/30/1992,11100,1992,9,30,274,1004
10/1/1992,9170,1992,10,1,275,1005
10/2/1992,8810,1992,10,2,276,1006
10/3/1992,8130,1992,10,3,277,1007
10/4/1992,7550,1992,10,4,278,1008
10/5/1992,8970,1992,10,5,279,1009
10/6/1992,9300,1992,10,6,280,1010
10/7/1992,8560,1992,10,7,281,1011
10/8/1992,9540,1992,10,8,282,1012
10/9/1992,9060,1992,10,9,283,1013
10/10/1992,7980,1992,10,10,284,1014
10/11/1992,7930,1992,10,11,285,1015
10/12/1992,8120,1992,10,12,286,1016
10/13/1992,9350,1992,10,13,287,1017
10/14/1992,9540,1992,10,14,288,1018
10/15/1992,9480,1992,10,15,289,1019
10/16/1992,9160,1992,10,16,290,1020
10/17/1992,7800,1992,10,17,291,1021
10/18/1992,7590,1992,10,18,292,1022
10/19/1992,8950,1992,10,19,293,1023
10/20/1992,9180,1992,10,20,294,1024
10/21/1992,9380,1992,10,21,295,1025
10/22/1992,9370,1992,10,22,296,1026
10/23/1992,9570,1992,10,23,297,1027
10/24/1992,8030,1992,10,24,298,1028
10/25/1992,7650,1992,10,25,299,1029
10/26/1992,8710,1992,10,26,300,1030
10/27/1992,8320,1992,10,27,301,1031
10/28/1992,8370,1992,10,28,302,1032
10/29/1992,8570,1992,10,29,303,1033
10/30/1992,9220,1992,10,30,304,1034
10/31/1992,8720,1992,10,31,305,1035
11/1/1992,8350,1992,11,1,306,1036
11/2/1992,10100,1992,11,2,307,1037
11/3/1992,10100,1992,11,3,308,1038
11/4/1992,9660,1992,11,4,309,1039
11/5/1992,9890,1992,11,5,310,1040
11/6/1992,9940,1992,11,6,311,1041
11/7/1992,9650,1992,11,7,312,1042
11/8/1992,8480,1992,11,8,313,1043
11/9/1992,9950,1992,11,9,314,1044
11/10/1992,10100,1992,11,10,315,1045
11/11/1992,10000,1992,11,11,316,1046
11/12/1992,10200,1992,11,12,317,1047
11/13/1992,10500,1992,11,13,318,1048
11/14/1992,9780,1992,11,14,319,1049
11/15/1992,8820,1992,11,15,320,1050
11/16/1992,10100,1992,11,16,321,1051
11/17/1992,10100,1992,11,17,322,1052
11/18/1992,10000,1992,11,18,323,1053
11/19/1992,10300,1992,11,19,324,1054
11/20/1992,10400,1992,11,20,325,1055
11/21/1992,9970,1992,11,21,326,1056
11/22/1992,8540,1992,11,22,327,1057
11/23/1992,10200,1992,11,23,328,1058
11/24/1992,10200,1992,11,24,329,1059
11/25/1992,10600,1992,11,25,330,1060
11/26/1992,9030,1992,11,26,331,1061
11/27/1992,10200,1992,11,27,332,1062
11/28/1992,10000,1992,11,28,333,1063
11/29/1992,8980,1992,11,29,334,1064
11/30/1992,10300,1992,11,30,335,1065
12/1/1992,11200,1992,12,1,336,1066
12/2/1992,11400,1992,12,2,337,1067
12/3/1992,11200,1992,12,3,338,1068
12/4/1992,11600,1992,12,4,339,1069
12/5/1992,11000,1992,12,5,340,1070
12/6/1992,10400,1992,12,6,341,1071
12/7/1992,11400,1992,12,7,342,1072
12/8/1992,11300,1992,12,8,343,1073
12/9/1992,11600,1992,12,9,344,1074
12/10/1992,11600,1992,12,10,345,1075
12/11/1992,11500,1992,12,11,346,1076
12/12/1992,11000,1992,12,12,347,1077
12/13/1992,10200,1992,12,13,348,1078
12/14/1992,11400,1992,12,14,349,1079
12/15/1992,11900,1992,12,15,350,1080
12/16/1992,11900,1992,12,16,351,1081
12/17/1992,11600,1992,12,17,352,1082
12/18/1992,11100,1992,12,18,353,1083
12/19/1992,10600,1992,12,19,354,1084
12/20/1992,9990,1992,12,20,355,1085
12/21/1992,11200,1992,12,21,356,1086
12/22/1992,11100,1992,12,22,357,1087
12/23/1992,10700,1992,12,23,358,1088
12/24/1992,10600,1992,12,24,359,1089
12/25/1992,10100,1992,12,25,360,1090
12/26/1992,10700,1992,12,26,361,1091
12/27/1992,10000,1992,12,27,362,1092
12/28/1992,10900,1992,12,28,363,1093
12/29/1992,10900,1992,12,29,364,1094
12/30/1992,11200,1992,12,30,365,1095
12/31/1992,10900,1992,12,31,366,1096
1/1/1993,10600,1993,1,1,1,1097
1/2/1993,12000,1993,1,2,2,1098
1/3/1993,11400,1993,1,3,3,1099
1/4/1993,12900,1993,1,4,4,1100
1/5/1993,12900,1993,1,5,5,1101
1/6/1993,13500,1993,1,6,6,1102
1/7/1993,13100,1993,1,7,7,1103
1/8/1993,13100,1993,1,8,8,1104
1/9/1993,11900,1993,1,9,9,1105
1/10/1993,11500,1993,1,10,10,1106
1/11/1993,13300,1993,1,11,11,1107
1/12/1993,13600,1993,1,12,12,1108
1/13/1993,13200,1993,1,13,13,1109
1/14/1993,12900,1993,1,14,14,1110
1/15/1993,13300,1993,1,15,15,1111
1/16/1993,12200,1993,1,16,16,1112
1/17/1993,11100,1993,1,17,17,1113
1/18/1993,13000,1993,1,18,18,1114
1/19/1993,13500,1993,1,19,19,1115
1/20/1993,14000,1993,1,20,20,1116
1/21/1993,13700,1993,1,21,21,1117
1/22/1993,13700,1993,1,22,22,1118
1/23/1993,12200,1993,1,23,23,1119
1/24/1993,11500,1993,1,24,24,1120
1/25/1993,13600,1993,1,25,25,1121
1/26/1993,13700,1993,1,26,26,1122
1/27/1993,13200,1993,1,27,27,1123
1/28/1993,13400,1993,1,28,28,1124
1/29/1993,13400,1993,1,29,29,1125
1/30/1993,12400,1993,1,30,30,1126
1/31/1993,11400,1993,1,31,31,1127
2/1/1993,12400,1993,2,1,32,1128
2/2/1993,12000,1993,2,2,33,1129
2/3/1993,12200,1993,2,3,34,1130
2/4/1993,11800,1993,2,4,35,1131
2/5/1993,12500,1993,2,5,36,1132
2/6/1993,11100,1993,2,6,37,1133
2/7/1993,9910,1993,2,7,38,1134
2/8/1993,11300,1993,2,8,39,1135
2/9/1993,11600,1993,2,9,40,1136
2/10/1993,11700,1993,2,10,41,1137
2/11/1993,11500,1993,2,11,42,1138
2/12/1993,11200,1993,2,12,43,1139
2/13/1993,11100,1993,2,13,44,1140
2/14/1993,10100,1993,2,14,45,1141
2/15/1993,11500,1993,2,15,46,1142
2/16/1993,11300,1993,2,16,47,1143
2/17/1993,11900,1993,2,17,48,1144
2/18/1993,11900,1993,2,18,49,1145
2/19/1993,11800,1993,2,19,50,1146
2/20/1993,11000,1993,2,20,51,1147
2/21/1993,9640,1993,2,21,52,1148
2/22/1993,11800,1993,2,22,53,1149
2/23/1993,11900,1993,2,23,54,1150
2/24/1993,11900,1993,2,24,55,1151
2/25/1993,12000,1993,2,25,56,1152
2/26/1993,12400,1993,2,26,57,1153
2/27/1993,11000,1993,2,27,58,1154
2/28/1993,11500,1993,2,28,59,1155
3/1/1993,9910,1993,3,1,60,1156
3/2/1993,9780,1993,3,2,61,1157
3/3/1993,9890,1993,3,3,62,1158
3/4/1993,9980,1993,3,4,63,1159
3/5/1993,9660,1993,3,5,64,1160
3/6/1993,9670,1993,3,6,65,1161
3/7/1993,8660,1993,3,7,66,1162
3/8/1993,9710,1993,3,8,67,1163
3/9/1993,9880,1993,3,9,68,1164
3/10/1993,9940,1993,3,10,69,1165
3/11/1993,9980,1993,3,11,70,1166
3/12/1993,10200,1993,3,12,71,1167
3/13/1993,9940,1993,3,13,72,1168
3/14/1993,9160,1993,3,14,73,1169
3/15/1993,10100,1993,3,15,74,1170
3/16/1993,11000,1993,3,16,75,1171
3/17/1993,10900,1993,3,17,76,1172
3/18/1993,10600,1993,3,18,77,1173
3/19/1993,10200,1993,3,19,78,1174
3/20/1993,9830,1993,3,20,79,1175
3/21/1993,8680,1993,3,21,80,1176
3/22/1993,9790,1993,3,22,81,1177
3/23/1993,9840,1993,3,23,82,1178
3/24/1993,9490,1993,3,24,83,1179
3/25/1993,9750,1993,3,25,84,1180
3/26/1993,9640,1993,3,26,85,1181
3/27/1993,9220,1993,3,27,86,1182
3/28/1993,8250,1993,3,28,87,1183
3/29/1993,9010,1993,3,29,88,1184
3/30/1993,9400,1993,3,30,89,1185
3/31/1993,9280,1993,3,31,90,1186
4/1/1993,9870,1993,4,1,91,1187
4/2/1993,10000,1993,4,2,92,1188
4/3/1993,9010,1993,4,3,93,1189
4/4/1993,7690,1993,4,4,94,1190
4/5/1993,9960,1993,4,5,95,1191
4/6/1993,10300,1993,4,6,96,1192
4/7/1993,10300,1993,4,7,97,1193
4/8/1993,10100,1993,4,8,98,1194
4/9/1993,9740,1993,4,9,99,1195
4/10/1993,8740,1993,4,10,100,1196
4/11/1993,7720,1993,4,11,101,1197
4/12/1993,10200,1993,4,12,102,1198
4/13/1993,10600,1993,4,13,103,1199
4/14/1993,10900,1993,4,14,104,1200
4/15/1993,10400,1993,4,15,105,1201
4/16/1993,11200,1993,4,16,106,1202
4/17/1993,10500,1993,4,17,107,1203
4/18/1993,9960,1993,4,18,108,1204
4/19/1993,10800,1993,4,19,109,1205
4/20/1993,11000,1993,4,20,110,1206
4/21/1993,11000,1993,4,21,111,1207
4/22/1993,10500,1993,4,22,112,1208
4/23/1993,10600,1993,4,23,113,1209
4/24/1993,9020,1993,4,24,114,1210
4/25/1993,7970,1993,4,25,115,1211
4/26/1993,10100,1993,4,26,116,1212
4/27/1993,10200,1993,4,27,117,1213
4/28/1993,9870,1993,4,28,118,1214
4/29/1993,10400,1993,4,29,119,1215
4/30/1993,10000,1993,4,30,120,1216
5/1/1993,8870,1993,5,1,121,1217
5/2/1993,7470,1993,5,2,122,1218
5/3/1993,10100,1993,5,3,123,1219
5/4/1993,10700,1993,5,4,124,1220
5/5/1993,10800,1993,5,5,125,1221
5/6/1993,10700,1993,5,6,126,1222
5/7/1993,11300,1993,5,7,127,1223
5/8/1993,9060,1993,5,8,128,1224
5/9/1993,7830,1993,5,9,129,1225
5/10/1993,10300,1993,5,10,130,1226
5/11/1993,11000,1993,5,11,131,1227
5/12/1993,10800,1993,5,12,132,1228
5/13/1993,11100,1993,5,13,133,1229
5/14/1993,10900,1993,5,14,134,1230
5/15/1993,9070,1993,5,15,135,1231
5/16/1993,7760,1993,5,16,136,1232
5/17/1993,10100,1993,5,17,137,1233
5/18/1993,10500,1993,5,18,138,1234
5/19/1993,10200,1993,5,19,139,1235
5/20/1993,10000,1993,5,20,140,1236
5/21/1993,9720,1993,5,21,141,1237
5/22/1993,9120,1993,5,22,142,1238
5/23/1993,9530,1993,5,23,143,1239
5/24/1993,10700,1993,5,24,144,1240
5/25/1993,8340,1993,5,25,145,1241
5/26/1993,10000,1993,5,26,146,1242
5/27/1993,9570,1993,5,27,147,1243
5/28/1993,9120,1993,5,28,148,1244
5/29/1993,8090,1993,5,29,149,1245
5/30/1993,8050,1993,5,30,150,1246
5/31/1993,8080,1993,5,31,151,1247
6/1/1993,9740,1993,6,1,152,1248
6/2/1993,10100,1993,6,2,153,1249
6/3/1993,9540,1993,6,3,154,1250
6/4/1993,9990,1993,6,4,155,1251
6/5/1993,7800,1993,6,5,156,1252
6/6/1993,7240,1993,6,6,157,1253
6/7/1993,9510,1993,6,7,158,1254
6/8/1993,9310,1993,6,8,159,1255
6/9/1993,9760,1993,6,9,160,1256
6/10/1993,10600,1993,6,10,161,1257
6/11/1993,10800,1993,6,11,162,1258
6/12/1993,9420,1993,6,12,163,1259
6/13/1993,8210,1993,6,13,164,1260
6/14/1993,9830,1993,6,14,165,1261
6/15/1993,10700,1993,6,15,166,1262
6/16/1993,11200,1993,6,16,167,1263
6/17/1993,11600,1993,6,17,168,1264
6/18/1993,11600,1993,6,18,169,1265
6/19/1993,10500,1993,6,19,170,1266
6/20/1993,10300,1993,6,20,171,1267
6/21/1993,10600,1993,6,21,172,1268
6/22/1993,10800,1993,6,22,173,1269
6/23/1993,11800,1993,6,23,174,1270
6/24/1993,11000,1993,6,24,175,1271
6/25/1993,10900,1993,6,25,176,1272
6/26/1993,10800,1993,6,26,177,1273
6/27/1993,10100,1993,6,27,178,1274
6/28/1993,11500,1993,6,28,179,1275
6/29/1993,12000,1993,6,29,180,1276
6/30/1993,12100,1993,6,30,181,1277
7/1/1993,14500,1993,7,1,182,1278
7/2/1993,14800,1993,7,2,183,1279
7/3/1993,13200,1993,7,3,184,1280
7/4/1993,10800,1993,7,4,185,1281
7/5/1993,11100,1993,7,5,186,1282
7/6/1993,14600,1993,7,6,187,1283
7/7/1993,14700,1993,7,7,188,1284
7/8/1993,14700,1993,7,8,189,1285
7/9/1993,15000,1993,7,9,190,1286
7/10/1993,14600,1993,7,10,191,1287
7/11/1993,12600,1993,7,11,192,1288
7/12/1993,14900,1993,7,12,193,1289
7/13/1993,15200,1993,7,13,194,1290
7/14/1993,15100,1993,7,14,195,1291
7/15/1993,14900,1993,7,15,196,1292
7/16/1993,14900,1993,7,16,197,1293
7/17/1993,14400,1993,7,17,198,1294
7/18/1993,12400,1993,7,18,199,1295
7/19/1993,15000,1993,7,19,200,1296
7/20/1993,15500,1993,7,20,201,1297
7/21/1993,15500,1993,7,21,202,1298
7/22/1993,15400,1993,7,22,203,1299
7/23/1993,15400,1993,7,23,204,1300
7/24/1993,14400,1993,7,24,205,1301
7/25/1993,13100,1993,7,25,206,1302
7/26/1993,15400,1993,7,26,207,1303
7/27/1993,16000,1993,7,27,208,1304
7/28/1993,16100,1993,7,28,209,1305
7/29/1993,16100,1993,7,29,210,1306
7/30/1993,16100,1993,7,30,211,1307
7/31/1993,15500,1993,7,31,212,1308
8/1/1993,14300,1993,8,1,213,1309
8/2/1993,16000,1993,8,2,214,1310
8/3/1993,16200,1993,8,3,215,1311
8/4/1993,16300,1993,8,4,216,1312
8/5/1993,16200,1993,8,5,217,1313
8/6/1993,16100,1993,8,6,218,1314
8/7/1993,15800,1993,8,7,219,1315
8/8/1993,14700,1993,8,8,220,1316
8/9/1993,16300,1993,8,9,221,1317
8/10/1993,16200,1993,8,10,222,1318
8/11/1993,16200,1993,8,11,223,1319
8/12/1993,16200,1993,8,12,224,1320
8/13/1993,16800,1993,8,13,225,1321
8/14/1993,16600,1993,8,14,226,1322
8/15/1993,15900,1993,8,15,227,1323
8/16/1993,17300,1993,8,16,228,1324
8/17/1993,15900,1993,8,17,229,1325
8/18/1993,15300,1993,8,18,230,1326
8/19/1993,14700,1993,8,19,231,1327
8/20/1993,14300,1993,8,20,232,1328
8/21/1993,13900,1993,8,21,233,1329
8/22/1993,12900,1993,8,22,234,1330
8/23/1993,14100,1993,8,23,235,1331
8/24/1993,14300,1993,8,24,236,1332
8/25/1993,14300,1993,8,25,237,1333
8/26/1993,14300,1993,8,26,238,1334
8/27/1993,14100,1993,8,27,239,1335
8/28/1993,13700,1993,8,28,240,1336
8/29/1993,11300,1993,8,29,241,1337
8/30/1993,14000,1993,8,30,242,1338
8/31/1993,13500,1993,8,31,243,1339
9/1/1993,12800,1993,9,1,244,1340
9/2/1993,12300,1993,9,2,245,1341
9/3/1993,12000,1993,9,3,246,1342
9/4/1993,11100,1993,9,4,247,1343
9/5/1993,9720,1993,9,5,248,1344
9/6/1993,9990,1993,9,6,249,1345
9/7/1993,11900,1993,9,7,250,1346
9/8/1993,11900,1993,9,8,251,1347
9/9/1993,11900,1993,9,9,252,1348
9/10/1993,11800,1993,9,10,253,1349
9/11/1993,10800,1993,9,11,254,1350
9/12/1993,8640,1993,9,12,255,1351
9/13/1993,11400,1993,9,13,256,1352
9/14/1993,11700,1993,9,14,257,1353
9/15/1993,11700,1993,9,15,258,1354
9/16/1993,11600,1993,9,16,259,1355
9/17/1993,11600,1993,9,17,260,1356
9/18/1993,10400,1993,9,18,261,1357
9/19/1993,8660,1993,9,19,262,1358
9/20/1993,11300,1993,9,20,263,1359
9/21/1993,11500,1993,9,21,264,1360
9/22/1993,11900,1993,9,22,265,1361
9/23/1993,11700,1993,9,23,266,1362
9/24/1993,11700,1993,9,24,267,1363
9/25/1993,10100,1993,9,25,268,1364
9/26/1993,8420,1993,9,26,269,1365
9/27/1993,11100,1993,9,27,270,1366
9/28/1993,11400,1993,9,28,271,1367
9/29/1993,11200,1993,9,29,272,1368
9/30/1993,11100,1993,9,30,273,1369
10/1/1993,9830,1993,10,1,274,1370
10/2/1993,8100,1993,10,2,275,1371
10/3/1993,7630,1993,10,3,276,1372
10/4/1993,8840,1993,10,4,277,1373
10/5/1993,8960,1993,10,5,278,1374
10/6/1993,9000,1993,10,6,279,1375
10/7/1993,8910,1993,10,7,280,1376
10/8/1993,8680,1993,10,8,281,1377
10/9/1993,8510,1993,10,9,282,1378
10/10/1993,7960,1993,10,10,283,1379
10/11/1993,8740,1993,10,11,284,1380
10/12/1993,9110,1993,10,12,285,1381
10/13/1993,9010,1993,10,13,286,1382
10/14/1993,9170,1993,10,14,287,1383
10/15/1993,8940,1993,10,15,288,1384
10/16/1993,8010,1993,10,16,289,1385
10/17/1993,7710,1993,10,17,290,1386
10/18/1993,8960,1993,10,18,291,1387
10/19/1993,8980,1993,10,19,292,1388
10/20/1993,8790,1993,10,20,293,1389
10/21/1993,8920,1993,10,21,294,1390
10/22/1993,9380,1993,10,22,295,1391
10/23/1993,8190,1993,10,23,296,1392
10/24/1993,7780,1993,10,24,297,1393
10/25/1993,9170,1993,10,25,298,1394
10/26/1993,9340,1993,10,26,299,1395
10/27/1993,8710,1993,10,27,300,1396
10/28/1993,8570,1993,10,28,301,1397
10/29/1993,8560,1993,10,29,302,1398
10/30/1993,8840,1993,10,30,303,1399
10/31/1993,7280,1993,10,31,304,1400
11/1/1993,9830,1993,11,1,305,1401
11/2/1993,12300,1993,11,2,306,1402
11/3/1993,12700,1993,11,3,307,1403
11/4/1993,12100,1993,11,4,308,1404
11/5/1993,12000,1993,11,5,309,1405
11/6/1993,9890,1993,11,6,310,1406
11/7/1993,8430,1993,11,7,311,1407
11/8/1993,12000,1993,11,8,312,1408
11/9/1993,12500,1993,11,9,313,1409
11/10/1993,11600,1993,11,10,314,1410
11/11/1993,11500,1993,11,11,315,1411
11/12/1993,11200,1993,11,12,316,1412
11/13/1993,9690,1993,11,13,317,1413
11/14/1993,8920,1993,11,14,318,1414
11/15/1993,10500,1993,11,15,319,1415
11/16/1993,10800,1993,11,16,320,1416
11/17/1993,10700,1993,11,17,321,1417
11/18/1993,10300,1993,11,18,322,1418
11/19/1993,10700,1993,11,19,323,1419
11/20/1993,9090,1993,11,20,324,1420
11/21/1993,8090,1993,11,21,325,1421
11/22/1993,10100,1993,11,22,326,1422
11/23/1993,10300,1993,11,23,327,1423
11/24/1993,10200,1993,11,24,328,1424
11/25/1993,8540,1993,11,25,329,1425
11/26/1993,9260,1993,11,26,330,1426
11/27/1993,8720,1993,11,27,331,1427
11/28/1993,7770,1993,11,28,332,1428
11/29/1993,9640,1993,11,29,333,1429
11/30/1993,10100,1993,11,30,334,1430
12/1/1993,11500,1993,12,1,335,1431
12/2/1993,13300,1993,12,2,336,1432
12/3/1993,13400,1993,12,3,337,1433
12/4/1993,12300,1993,12,4,338,1434
12/5/1993,11600,1993,12,5,339,1435
12/6/1993,13700,1993,12,6,340,1436
12/7/1993,13200,1993,12,7,341,1437
12/8/1993,13800,1993,12,8,342,1438
12/9/1993,13400,1993,12,9,343,1439
12/10/1993,13000,1993,12,10,344,1440
12/11/1993,11600,1993,12,11,345,1441
12/12/1993,10900,1993,12,12,346,1442
12/13/1993,13300,1993,12,13,347,1443
12/14/1993,14000,1993,12,14,348,1444
12/15/1993,14000,1993,12,15,349,1445
12/16/1993,14700,1993,12,16,350,1446
12/17/1993,14300,1993,12,17,351,1447
12/18/1993,13400,1993,12,18,352,1448
12/19/1993,12700,1993,12,19,353,1449
12/20/1993,14300,1993,12,20,354,1450
12/21/1993,13700,1993,12,21,355,1451
12/22/1993,13800,1993,12,22,356,1452
12/23/1993,14000,1993,12,23,357,1453
12/24/1993,12500,1993,12,24,358,1454
12/25/1993,11200,1993,12,25,359,1455
12/26/1993,11500,1993,12,26,360,1456
12/27/1993,13400,1993,12,27,361,1457
12/28/1993,13200,1993,12,28,362,1458
12/29/1993,11800,1993,12,29,363,1459
12/30/1993,12500,1993,12,30,364,1460
12/31/1993,11200,1993,12,31,365,1461
1/1/1994,12200,1994,1,1,1,1462
1/2/1994,10600,1994,1,2,2,1463
1/3/1994,13800,1994,1,3,3,1464
1/4/1994,13700,1994,1,4,4,1465
1/5/1994,14100,1994,1,5,5,1466
1/6/1994,14300,1994,1,6,6,1467
1/7/1994,14900,1994,1,7,7,1468
1/8/1994,12700,1994,1,8,8,1469
1/9/1994,10900,1994,1,9,9,1470
1/10/1994,14500,1994,1,10,10,1471
1/11/1994,14700,1994,1,11,11,1472
1/12/1994,14500,1994,1,12,12,1473
1/13/1994,14900,1994,1,13,13,1474
1/14/1994,14600,1994,1,14,14,1475
1/15/1994,12500,1994,1,15,15,1476
1/16/1994,10300,1994,1,16,16,1477
1/17/1994,13500,1994,1,17,17,1478
1/18/1994,13800,1994,1,18,18,1479
1/19/1994,14200,1994,1,19,19,1480
1/20/1994,14100,1994,1,20,20,1481
1/21/1994,12600,1994,1,21,21,1482
1/22/1994,10700,1994,1,22,22,1483
1/23/1994,9610,1994,1,23,23,1484
1/24/1994,12100,1994,1,24,24,1485
1/25/1994,12900,1994,1,25,25,1486
1/26/1994,13300,1994,1,26,26,1487
1/27/1994,13600,1994,1,27,27,1488
1/28/1994,13400,1994,1,28,28,1489
1/29/1994,11300,1994,1,29,29,1490
1/30/1994,10700,1994,1,30,30,1491
1/31/1994,14600,1994,1,31,31,1492
2/1/1994,12900,1994,2,1,32,1493
2/2/1994,12700,1994,2,2,33,1494
2/3/1994,13200,1994,2,3,34,1495
2/4/1994,13100,1994,2,4,35,1496
2/5/1994,11800,1994,2,5,36,1497
2/6/1994,10300,1994,2,6,37,1498
2/7/1994,13200,1994,2,7,38,1499
2/8/1994,13900,1994,2,8,39,1500
2/9/1994,13800,1994,2,9,40,1501
2/10/1994,13500,1994,2,10,41,1502
2/11/1994,13500,1994,2,11,42,1503
2/12/1994,11700,1994,2,12,43,1504
2/13/1994,9840,1994,2,13,44,1505
2/14/1994,12800,1994,2,14,45,1506
2/15/1994,13400,1994,2,15,46,1507
2/16/1994,13600,1994,2,16,47,1508
2/17/1994,12900,1994,2,17,48,1509
2/18/1994,13200,1994,2,18,49,1510
2/19/1994,12000,1994,2,19,50,1511
2/20/1994,9760,1994,2,20,51,1512
2/21/1994,12600,1994,2,21,52,1513
2/22/1994,13300,1994,2,22,53,1514
2/23/1994,13000,1994,2,23,54,1515
2/24/1994,13100,1994,2,24,55,1516
2/25/1994,12900,1994,2,25,56,1517
2/26/1994,11400,1994,2,26,57,1518
2/27/1994,9680,1994,2,27,58,1519
2/28/1994,12700,1994,2,28,59,1520
3/1/1994,10400,1994,3,1,60,1521
3/2/1994,10100,1994,3,2,61,1522
3/3/1994,10300,1994,3,3,62,1523
3/4/1994,10000,1994,3,4,63,1524
3/5/1994,9830,1994,3,5,64,1525
3/6/1994,8720,1994,3,6,65,1526
3/7/1994,9790,1994,3,7,66,1527
3/8/1994,9990,1994,3,8,67,1528
3/9/1994,9980,1994,3,9,68,1529
3/10/1994,10000,1994,3,10,69,1530
3/11/1994,10300,1994,3,11,70,1531
3/12/1994,9870,1994,3,12,71,1532
3/13/1994,9600,1994,3,13,72,1533
3/14/1994,10300,1994,3,14,73,1534
3/15/1994,10300,1994,3,15,74,1535
3/16/1994,10400,1994,3,16,75,1536
3/17/1994,10400,1994,3,17,76,1537
3/18/1994,10400,1994,3,18,77,1538
3/19/1994,10200,1994,3,19,78,1539
3/20/1994,9260,1994,3,20,79,1540
3/21/1994,10500,1994,3,21,80,1541
3/22/1994,11000,1994,3,22,81,1542
3/23/1994,10900,1994,3,23,82,1543
3/24/1994,10900,1994,3,24,83,1544
3/25/1994,10500,1994,3,25,84,1545
3/26/1994,9650,1994,3,26,85,1546
3/27/1994,8690,1994,3,27,86,1547
3/28/1994,10300,1994,3,28,87,1548
3/29/1994,10200,1994,3,29,88,1549
3/30/1994,9530,1994,3,30,89,1550
3/31/1994,9890,1994,3,31,90,1551
4/1/1994,9630,1994,4,1,91,1552
4/2/1994,8580,1994,4,2,92,1553
4/3/1994,8040,1994,4,3,93,1554
4/4/1994,9410,1994,4,4,94,1555
4/5/1994,10400,1994,4,5,95,1556
4/6/1994,10400,1994,4,6,96,1557
4/7/1994,10600,1994,4,7,97,1558
4/8/1994,10700,1994,4,8,98,1559
4/9/1994,10100,1994,4,9,99,1560
4/10/1994,9190,1994,4,10,100,1561
4/11/1994,10800,1994,4,11,101,1562
4/12/1994,11000,1994,4,12,102,1563
4/13/1994,10900,1994,4,13,103,1564
4/14/1994,10900,1994,4,14,104,1565
4/15/1994,11700,1994,4,15,105,1566
4/16/1994,10500,1994,4,16,106,1567
4/17/1994,9580,1994,4,17,107,1568
4/18/1994,11900,1994,4,18,108,1569
4/19/1994,12400,1994,4,19,109,1570
4/20/1994,12300,1994,4,20,110,1571
4/21/1994,11600,1994,4,21,111,1572
4/22/1994,11200,1994,4,22,112,1573
4/23/1994,9650,1994,4,23,113,1574
4/24/1994,8690,1994,4,24,114,1575
4/25/1994,11000,1994,4,25,115,1576
4/26/1994,11300,1994,4,26,116,1577
4/27/1994,11300,1994,4,27,117,1578
4/28/1994,11300,1994,4,28,118,1579
4/29/1994,11000,1994,4,29,119,1580
4/30/1994,9550,1994,4,30,120,1581
5/1/1994,7750,1994,5,1,121,1582
5/2/1994,9830,1994,5,2,122,1583
5/3/1994,10100,1994,5,3,123,1584
5/4/1994,10600,1994,5,4,124,1585
5/5/1994,10700,1994,5,5,125,1586
5/6/1994,10600,1994,5,6,126,1587
5/7/1994,8730,1994,5,7,127,1588
5/8/1994,7600,1994,5,8,128,1589
5/9/1994,9860,1994,5,9,129,1590
5/10/1994,10700,1994,5,10,130,1591
5/11/1994,10700,1994,5,11,131,1592
5/12/1994,10900,1994,5,12,132,1593
5/13/1994,11100,1994,5,13,133,1594
5/14/1994,10500,1994,5,14,134,1595
5/15/1994,11000,1994,5,15,135,1596
5/16/1994,10800,1994,5,16,136,1597
5/17/1994,11000,1994,5,17,137,1598
5/18/1994,11300,1994,5,18,138,1599
5/19/1994,11300,1994,5,19,139,1600
5/20/1994,10800,1994,5,20,140,1601
5/21/1994,8320,1994,5,21,141,1602
5/22/1994,7750,1994,5,22,142,1603
5/23/1994,10800,1994,5,23,143,1604
5/24/1994,10900,1994,5,24,144,1605
5/25/1994,10100,1994,5,25,145,1606
5/26/1994,9840,1994,5,26,146,1607
5/27/1994,9650,1994,5,27,147,1608
5/28/1994,8400,1994,5,28,148,1609
5/29/1994,8150,1994,5,29,149,1610
5/30/1994,8150,1994,5,30,150,1611
5/31/1994,10300,1994,5,31,151,1612
6/1/1994,10200,1994,6,1,152,1613
6/2/1994,10500,1994,6,2,153,1614
6/3/1994,10100,1994,6,3,154,1615
6/4/1994,8160,1994,6,4,155,1616
6/5/1994,7740,1994,6,5,156,1617
6/6/1994,9560,1994,6,6,157,1618
6/7/1994,9940,1994,6,7,158,1619
6/8/1994,10300,1994,6,8,159,1620
6/9/1994,10500,1994,6,9,160,1621
6/10/1994,10400,1994,6,10,161,1622
6/11/1994,9860,1994,6,11,162,1623
6/12/1994,9220,1994,6,12,163,1624
6/13/1994,11500,1994,6,13,164,1625
6/14/1994,11500,1994,6,14,165,1626
6/15/1994,11400,1994,6,15,166,1627
6/16/1994,11300,1994,6,16,167,1628
6/17/1994,11200,1994,6,17,168,1629
6/18/1994,9620,1994,6,18,169,1630
6/19/1994,8800,1994,6,19,170,1631
6/20/1994,11700,1994,6,20,171,1632
6/21/1994,12200,1994,6,21,172,1633
6/22/1994,11500,1994,6,22,173,1634
6/23/1994,11300,1994,6,23,174,1635
6/24/1994,11600,1994,6,24,175,1636
6/25/1994,10200,1994,6,25,176,1637
6/26/1994,9790,1994,6,26,177,1638
6/27/1994,10800,1994,6,27,178,1639
6/28/1994,11500,1994,6,28,179,1640
6/29/1994,12400,1994,6,29,180,1641
6/30/1994,14100,1994,6,30,181,1642
7/1/1994,14400,1994,7,1,182,1643
7/2/1994,13500,1994,7,2,183,1644
7/3/1994,11100,1994,7,3,184,1645
7/4/1994,10600,1994,7,4,185,1646
7/5/1994,14600,1994,7,5,186,1647
7/6/1994,14700,1994,7,6,187,1648
7/7/1994,14600,1994,7,7,188,1649
7/8/1994,14300,1994,7,8,189,1650
7/9/1994,13000,1994,7,9,190,1651
7/10/1994,11100,1994,7,10,191,1652
7/11/1994,14700,1994,7,11,192,1653
7/12/1994,15300,1994,7,12,193,1654
7/13/1994,14700,1994,7,13,194,1655
7/14/1994,14900,1994,7,14,195,1656
7/15/1994,15300,1994,7,15,196,1657
7/16/1994,13400,1994,7,16,197,1658
7/17/1994,12500,1994,7,17,198,1659
7/18/1994,14600,1994,7,18,199,1660
7/19/1994,14800,1994,7,19,200,1661
7/20/1994,14300,1994,7,20,201,1662
7/21/1994,15000,1994,7,21,202,1663
7/22/1994,14500,1994,7,22,203,1664
7/23/1994,12900,1994,7,23,204,1665
7/24/1994,11000,1994,7,24,205,1666
7/25/1994,14300,1994,7,25,206,1667
7/26/1994,15100,1994,7,26,207,1668
7/27/1994,15200,1994,7,27,208,1669
7/28/1994,15800,1994,7,28,209,1670
7/29/1994,15400,1994,7,29,210,1671
7/30/1994,13500,1994,7,30,211,1672
7/31/1994,11900,1994,7,31,212,1673
8/1/1994,15000,1994,8,1,213,1674
8/2/1994,15200,1994,8,2,214,1675
8/3/1994,15100,1994,8,3,215,1676
8/4/1994,15200,1994,8,4,216,1677
8/5/1994,15200,1994,8,5,217,1678
8/6/1994,13500,1994,8,6,218,1679
8/7/1994,12400,1994,8,7,219,1680
8/8/1994,14800,1994,8,8,220,1681
8/9/1994,15600,1994,8,9,221,1682
8/10/1994,15500,1994,8,10,222,1683
8/11/1994,14900,1994,8,11,223,1684
8/12/1994,15300,1994,8,12,224,1685
8/13/1994,13100,1994,8,13,225,1686
8/14/1994,11300,1994,8,14,226,1687
8/15/1994,15300,1994,8,15,227,1688
8/16/1994,15600,1994,8,16,228,1689
8/17/1994,15200,1994,8,17,229,1690
8/18/1994,15800,1994,8,18,230,1691
8/19/1994,14800,1994,8,19,231,1692
8/20/1994,12800,1994,8,20,232,1693
8/21/1994,12300,1994,8,21,233,1694
8/22/1994,13900,1994,8,22,234,1695
8/23/1994,13700,1994,8,23,235,1696
8/24/1994,14200,1994,8,24,236,1697
8/25/1994,14200,1994,8,25,237,1698
8/26/1994,14300,1994,8,26,238,1699
8/27/1994,12400,1994,8,27,239,1700
8/28/1994,10800,1994,8,28,240,1701
8/29/1994,14200,1994,8,29,241,1702
8/30/1994,14400,1994,8,30,242,1703
8/31/1994,14400,1994,8,31,243,1704
9/1/1994,11900,1994,9,1,244,1705
9/2/1994,11900,1994,9,2,245,1706
9/3/1994,10000,1994,9,3,246,1707
9/4/1994,9510,1994,9,4,247,1708
9/5/1994,9530,1994,9,5,248,1709
9/6/1994,11600,1994,9,6,249,1710
9/7/1994,11500,1994,9,7,250,1711
9/8/1994,11600,1994,9,8,251,1712
9/9/1994,11800,1994,9,9,252,1713
9/10/1994,10000,1994,9,10,253,1714
9/11/1994,8890,1994,9,11,254,1715
9/12/1994,10800,1994,9,12,255,1716
9/13/1994,11100,1994,9,13,256,1717
9/14/1994,11200,1994,9,14,257,1718
9/15/1994,11000,1994,9,15,258,1719
9/16/1994,11100,1994,9,16,259,1720
9/17/1994,9490,1994,9,17,260,1721
9/18/1994,8700,1994,9,18,261,1722
9/19/1994,11000,1994,9,19,262,1723
9/20/1994,11300,1994,9,20,263,1724
9/21/1994,11300,1994,9,21,264,1725
9/22/1994,10900,1994,9,22,265,1726
9/23/1994,11000,1994,9,23,266,1727
9/24/1994,9410,1994,9,24,267,1728
9/25/1994,8490,1994,9,25,268,1729
9/26/1994,11000,1994,9,26,269,1730
9/27/1994,11000,1994,9,27,270,1731
9/28/1994,11100,1994,9,28,271,1732
9/29/1994,10900,1994,9,29,272,1733
9/30/1994,10800,1994,9,30,273,1734
10/1/1994,8150,1994,10,1,274,1735
10/2/1994,8160,1994,10,2,275,1736
10/3/1994,8460,1994,10,3,276,1737
10/4/1994,8670,1994,10,4,277,1738
10/5/1994,8330,1994,10,5,278,1739
10/6/1994,8150,1994,10,6,279,1740
10/7/1994,8610,1994,10,7,280,1741
10/8/1994,7940,1994,10,8,281,1742
10/9/1994,8010,1994,10,9,282,1743
10/10/1994,9450,1994,10,10,283,1744
10/11/1994,9500,1994,10,11,284,1745
10/12/1994,8730,1994,10,12,285,1746
10/13/1994,8910,1994,10,13,286,1747
10/14/1994,8370,1994,10,14,287,1748
10/15/1994,7290,1994,10,15,288,1749
10/16/1994,7220,1994,10,16,289,1750
10/17/1994,8560,1994,10,17,290,1751
10/18/1994,9040,1994,10,18,291,1752
10/19/1994,8990,1994,10,19,292,1753
10/20/1994,8500,1994,10,20,293,1754
10/21/1994,7770,1994,10,21,294,1755
10/22/1994,7710,1994,10,22,295,1756
10/23/1994,7620,1994,10,23,296,1757
10/24/1994,8440,1994,10,24,297,1758
10/25/1994,7350,1994,10,25,298,1759
10/26/1994,6840,1994,10,26,299,1760
10/27/1994,7490,1994,10,27,300,1761
10/28/1994,7710,1994,10,28,301,1762
10/29/1994,7410,1994,10,29,302,1763
10/30/1994,8080,1994,10,30,303,1764
10/31/1994,7860,1994,10,31,304,1765
11/1/1994,8180,1994,11,1,305,1766
11/2/1994,7920,1994,11,2,306,1767
11/3/1994,8160,1994,11,3,307,1768
11/4/1994,8780,1994,11,4,308,1769
11/5/1994,7750,1994,11,5,309,1770
11/6/1994,7660,1994,11,6,310,1771
11/7/1994,8820,1994,11,7,311,1772
11/8/1994,8610,1994,11,8,312,1773
11/9/1994,8320,1994,11,9,313,1774
11/10/1994,8490,1994,11,10,314,1775
11/11/1994,9050,1994,11,11,315,1776
11/12/1994,7480,1994,11,12,316,1777
11/13/1994,7190,1994,11,13,317,1778
11/14/1994,8890,1994,11,14,318,1779
11/15/1994,8910,1994,11,15,319,1780
11/16/1994,9050,1994,11,16,320,1781
11/17/1994,9410,1994,11,17,321,1782
11/18/1994,8680,1994,11,18,322,1783
11/19/1994,8130,1994,11,19,323,1784
11/20/1994,7940,1994,11,20,324,1785
11/21/1994,8640,1994,11,21,325,1786
11/22/1994,8760,1994,11,22,326,1787
11/23/1994,8870,1994,11,23,327,1788
11/24/1994,7750,1994,11,24,328,1789
11/25/1994,8600,1994,11,25,329,1790
11/26/1994,8370,1994,11,26,330,1791
11/27/1994,7900,1994,11,27,331,1792
11/28/1994,9020,1994,11,28,332,1793
11/29/1994,8890,1994,11,29,333,1794
11/30/1994,9260,1994,11,30,334,1795
12/1/1994,10300,1994,12,1,335,1796
12/2/1994,11400,1994,12,2,336,1797
12/3/1994,10600,1994,12,3,337,1798
12/4/1994,9360,1994,12,4,338,1799
12/5/1994,12000,1994,12,5,339,1800
12/6/1994,12300,1994,12,6,340,1801
12/7/1994,12200,1994,12,7,341,1802
12/8/1994,12500,1994,12,8,342,1803
12/9/1994,12200,1994,12,9,343,1804
12/10/1994,10500,1994,12,10,344,1805
12/11/1994,9860,1994,12,11,345,1806
12/12/1994,12000,1994,12,12,346,1807
12/13/1994,12200,1994,12,13,347,1808
12/14/1994,12400,1994,12,14,348,1809
12/15/1994,12600,1994,12,15,349,1810
12/16/1994,12200,1994,12,16,350,1811
12/17/1994,10800,1994,12,17,351,1812
12/18/1994,9350,1994,12,18,352,1813
12/19/1994,11400,1994,12,19,353,1814
12/20/1994,11800,1994,12,20,354,1815
12/21/1994,10700,1994,12,21,355,1816
12/22/1994,10900,1994,12,22,356,1817
12/23/1994,10800,1994,12,23,357,1818
12/24/1994,10600,1994,12,24,358,1819
12/25/1994,8770,1994,12,25,359,1820
12/26/1994,8910,1994,12,26,360,1821
12/27/1994,10700,1994,12,27,361,1822
12/28/1994,11000,1994,12,28,362,1823
12/29/1994,10400,1994,12,29,363,1824
12/30/1994,11800,1994,12,30,364,1825
12/31/1994,10600,1994,12,31,365,1826
1/1/1995,8960,1995,1,1,1,1827
1/2/1995,8920,1995,1,2,2,1828
1/3/1995,12100,1995,1,3,3,1829
1/4/1995,13000,1995,1,4,4,1830
1/5/1995,14100,1995,1,5,5,1831
1/6/1995,14300,1995,1,6,6,1832
1/7/1995,13000,1995,1,7,7,1833
1/8/1995,12000,1995,1,8,8,1834
1/9/1995,13400,1995,1,9,9,1835
1/10/1995,13400,1995,1,10,10,1836
1/11/1995,13400,1995,1,11,11,1837
1/12/1995,13300,1995,1,12,12,1838
1/13/1995,12800,1995,1,13,13,1839
1/14/1995,11600,1995,1,14,14,1840
1/15/1995,10400,1995,1,15,15,1841
1/16/1995,13200,1995,1,16,16,1842
1/17/1995,13700,1995,1,17,17,1843
1/18/1995,13200,1995,1,18,18,1844
1/19/1995,12500,1995,1,19,19,1845
1/20/1995,12100,1995,1,20,20,1846
1/21/1995,12200,1995,1,21,21,1847
1/22/1995,11600,1995,1,22,22,1848
1/23/1995,12500,1995,1,23,23,1849
1/24/1995,13000,1995,1,24,24,1850
1/25/1995,13100,1995,1,25,25,1851
1/26/1995,13300,1995,1,26,26,1852
1/27/1995,12800,1995,1,27,27,1853
1/28/1995,11600,1995,1,28,28,1854
1/29/1995,9580,1995,1,29,29,1855
1/30/1995,10200,1995,1,30,30,1856
1/31/1995,12100,1995,1,31,31,1857
2/1/1995,11500,1995,2,1,32,1858
2/2/1995,10100,1995,2,2,33,1859
2/3/1995,10500,1995,2,3,34,1860
2/4/1995,9850,1995,2,4,35,1861
2/5/1995,9100,1995,2,5,36,1862
2/6/1995,10700,1995,2,6,37,1863
2/7/1995,10800,1995,2,7,38,1864
2/8/1995,10900,1995,2,8,39,1865
2/9/1995,11000,1995,2,9,40,1866
2/10/1995,11400,1995,2,10,41,1867
2/11/1995,11300,1995,2,11,42,1868
2/12/1995,10100,1995,2,12,43,1869
2/13/1995,13000,1995,2,13,44,1870
2/14/1995,13900,1995,2,14,45,1871
2/15/1995,13400,1995,2,15,46,1872
2/16/1995,13900,1995,2,16,47,1873
2/17/1995,13300,1995,2,17,48,1874
2/18/1995,12400,1995,2,18,49,1875
2/19/1995,10400,1995,2,19,50,1876
2/20/1995,12300,1995,2,20,51,1877
2/21/1995,13000,1995,2,21,52,1878
2/22/1995,13100,1995,2,22,53,1879
2/23/1995,12700,1995,2,23,54,1880
2/24/1995,12100,1995,2,24,55,1881
2/25/1995,11600,1995,2,25,56,1882
2/26/1995,10900,1995,2,26,57,1883
2/27/1995,13200,1995,2,27,58,1884
2/28/1995,13400,1995,2,28,59,1885
3/1/1995,11000,1995,3,1,60,1886
3/2/1995,10700,1995,3,2,61,1887
3/3/1995,10500,1995,3,3,62,1888
3/4/1995,9710,1995,3,4,63,1889
3/5/1995,8860,1995,3,5,64,1890
3/6/1995,9890,1995,3,6,65,1891
3/7/1995,9210,1995,3,7,66,1892
3/8/1995,9330,1995,3,8,67,1893
3/9/1995,9080,1995,3,9,68,1894
3/10/1995,9280,1995,3,10,69,1895
3/11/1995,8590,1995,3,11,70,1896
3/12/1995,8310,1995,3,12,71,1897
3/13/1995,9840,1995,3,13,72,1898
3/14/1995,9980,1995,3,14,73,1899
3/15/1995,10000,1995,3,15,74,1900
3/16/1995,10200,1995,3,16,75,1901
3/17/1995,10400,1995,3,17,76,1902
3/18/1995,8910,1995,3,18,77,1903
3/19/1995,9270,1995,3,19,78,1904
3/20/1995,10300,1995,3,20,79,1905
3/21/1995,10600,1995,3,21,80,1906
3/22/1995,10600,1995,3,22,81,1907
3/23/1995,10300,1995,3,23,82,1908
3/24/1995,9950,1995,3,24,83,1909
3/25/1995,9480,1995,3,25,84,1910
3/26/1995,8990,1995,3,26,85,1911
3/27/1995,10500,1995,3,27,86,1912
3/28/1995,10500,1995,3,28,87,1913
3/29/1995,10300,1995,3,29,88,1914
3/30/1995,10300,1995,3,30,89,1915
3/31/1995,9910,1995,3,31,90,1916
4/1/1995,8800,1995,4,1,91,1917
4/2/1995,8610,1995,4,2,92,1918
4/3/1995,10500,1995,4,3,93,1919
4/4/1995,10600,1995,4,4,94,1920
4/5/1995,11100,1995,4,5,95,1921
4/6/1995,10800,1995,4,6,96,1922
4/7/1995,10900,1995,4,7,97,1923
4/8/1995,8800,1995,4,8,98,1924
4/9/1995,8500,1995,4,9,99,1925
4/10/1995,11300,1995,4,10,100,1926
4/11/1995,11500,1995,4,11,101,1927
4/12/1995,11700,1995,4,12,102,1928
4/13/1995,11700,1995,4,13,103,1929
4/14/1995,11800,1995,4,14,104,1930
4/15/1995,10000,1995,4,15,105,1931
4/16/1995,8370,1995,4,16,106,1932
4/17/1995,11400,1995,4,17,107,1933
4/18/1995,11600,1995,4,18,108,1934
4/19/1995,11800,1995,4,19,109,1935
4/20/1995,11600,1995,4,20,110,1936
4/21/1995,11600,1995,4,21,111,1937
4/22/1995,9530,1995,4,22,112,1938
4/23/1995,8520,1995,4,23,113,1939
4/24/1995,11300,1995,4,24,114,1940
4/25/1995,12000,1995,4,25,115,1941
4/26/1995,12000,1995,4,26,116,1942
4/27/1995,11600,1995,4,27,117,1943
4/28/1995,11500,1995,4,28,118,1944
4/29/1995,10400,1995,4,29,119,1945
4/30/1995,9530,1995,4,30,120,1946
5/1/1995,10900,1995,5,1,121,1947
5/2/1995,10900,1995,5,2,122,1948
5/3/1995,10800,1995,5,3,123,1949
5/4/1995,10700,1995,5,4,124,1950
5/5/1995,10700,1995,5,5,125,1951
5/6/1995,9390,1995,5,6,126,1952
5/7/1995,8420,1995,5,7,127,1953
5/8/1995,11100,1995,5,8,128,1954
5/9/1995,11000,1995,5,9,129,1955
5/10/1995,11100,1995,5,10,130,1956
5/11/1995,11000,1995,5,11,131,1957
5/12/1995,11300,1995,5,12,132,1958
5/13/1995,8750,1995,5,13,133,1959
5/14/1995,8820,1995,5,14,134,1960
5/15/1995,10800,1995,5,15,135,1961
5/16/1995,11300,1995,5,16,136,1962
5/17/1995,10900,1995,5,17,137,1963
5/18/1995,11500,1995,5,18,138,1964
5/19/1995,11300,1995,5,19,139,1965
5/20/1995,8870,1995,5,20,140,1966
5/21/1995,8240,1995,5,21,141,1967
5/22/1995,10600,1995,5,22,142,1968
5/23/1995,9930,1995,5,23,143,1969
5/24/1995,10200,1995,5,24,144,1970
5/25/1995,9860,1995,5,25,145,1971
5/26/1995,9700,1995,5,26,146,1972
5/27/1995,8210,1995,5,27,147,1973
5/28/1995,8080,1995,5,28,148,1974
5/29/1995,8060,1995,5,29,149,1975
5/30/1995,9760,1995,5,30,150,1976
5/31/1995,12900,1995,5,31,151,1977
6/1/1995,17300,1995,6,1,152,1978
6/2/1995,17200,1995,6,2,153,1979
6/3/1995,15600,1995,6,3,154,1980
6/4/1995,15300,1995,6,4,155,1981
6/5/1995,16700,1995,6,5,156,1982
6/6/1995,16900,1995,6,6,157,1983
6/7/1995,16900,1995,6,7,158,1984
6/8/1995,16900,1995,6,8,159,1985
6/9/1995,17100,1995,6,9,160,1986
6/10/1995,15500,1995,6,10,161,1987
6/11/1995,15100,1995,6,11,162,1988
6/12/1995,16500,1995,6,12,163,1989
6/13/1995,16600,1995,6,13,164,1990
6/14/1995,16700,1995,6,14,165,1991
6/15/1995,17000,1995,6,15,166,1992
6/16/1995,16800,1995,6,16,167,1993
6/17/1995,15800,1995,6,17,168,1994
6/18/1995,15500,1995,6,18,169,1995
6/19/1995,16600,1995,6,19,170,1996
6/20/1995,16700,1995,6,20,171,1997
6/21/1995,16900,1995,6,21,172,1998
6/22/1995,16600,1995,6,22,173,1999
6/23/1995,17100,1995,6,23,174,2000
6/24/1995,16900,1995,6,24,175,2001
6/25/1995,17100,1995,6,25,176,2002
6/26/1995,17000,1995,6,26,177,2003
6/27/1995,16700,1995,6,27,178,2004
6/28/1995,16500,1995,6,28,179,2005
6/29/1995,15700,1995,6,29,180,2006
6/30/1995,15700,1995,6,30,181,2007
7/1/1995,15400,1995,7,1,182,2008
7/2/1995,14600,1995,7,2,183,2009
7/3/1995,16600,1995,7,3,184,2010
7/4/1995,15600,1995,7,4,185,2011
7/5/1995,16200,1995,7,5,186,2012
7/6/1995,16700,1995,7,6,187,2013
7/7/1995,17000,1995,7,7,188,2014
7/8/1995,17200,1995,7,8,189,2015
7/9/1995,16000,1995,7,9,190,2016
7/10/1995,16800,1995,7,10,191,2017
7/11/1995,17400,1995,7,11,192,2018
7/12/1995,18100,1995,7,12,193,2019
7/13/1995,17900,1995,7,13,194,2020
7/14/1995,17400,1995,7,14,195,2021
7/15/1995,17100,1995,7,15,196,2022
7/16/1995,17100,1995,7,16,197,2023
7/17/1995,18000,1995,7,17,198,2024
7/18/1995,18500,1995,7,18,199,2025
7/19/1995,18400,1995,7,19,200,2026
7/20/1995,17800,1995,7,20,201,2027
7/21/1995,17600,1995,7,21,202,2028
7/22/1995,17600,1995,7,22,203,2029
7/23/1995,17000,1995,7,23,204,2030
7/24/1995,18100,1995,7,24,205,2031
7/25/1995,18400,1995,7,25,206,2032
7/26/1995,18300,1995,7,26,207,2033
7/27/1995,18700,1995,7,27,208,2034
7/28/1995,18900,1995,7,28,209,2035
7/29/1995,19100,1995,7,29,210,2036
7/30/1995,19000,1995,7,30,211,2037
7/31/1995,19000,1995,7,31,212,2038
8/1/1995,18600,1995,8,1,213,2039
8/2/1995,18600,1995,8,2,214,2040
8/3/1995,19000,1995,8,3,215,2041
8/4/1995,19300,1995,8,4,216,2042
8/5/1995,19400,1995,8,5,217,2043
8/6/1995,19400,1995,8,6,218,2044
8/7/1995,19400,1995,8,7,219,2045
8/8/1995,19200,1995,8,8,220,2046
8/9/1995,19100,1995,8,9,221,2047
8/10/1995,19000,1995,8,10,222,2048
8/11/1995,18400,1995,8,11,223,2049
8/12/1995,18400,1995,8,12,224,2050
8/13/1995,18600,1995,8,13,225,2051
8/14/1995,18600,1995,8,14,226,2052
8/15/1995,18600,1995,8,15,227,2053
8/16/1995,18600,1995,8,16,228,2054
8/17/1995,18500,1995,8,17,229,2055
8/18/1995,18400,1995,8,18,230,2056
8/19/1995,18200,1995,8,19,231,2057
8/20/1995,18300,1995,8,20,232,2058
8/21/1995,18000,1995,8,21,233,2059
8/22/1995,17700,1995,8,22,234,2060
8/23/1995,17400,1995,8,23,235,2061
8/24/1995,17900,1995,8,24,236,2062
8/25/1995,17800,1995,8,25,237,2063
8/26/1995,16600,1995,8,26,238,2064
8/27/1995,15000,1995,8,27,239,2065
8/28/1995,17000,1995,8,28,240,2066
8/29/1995,18100,1995,8,29,241,2067
8/30/1995,17600,1995,8,30,242,2068
8/31/1995,17500,1995,8,31,243,2069
9/1/1995,18200,1995,9,1,244,2070
9/2/1995,17600,1995,9,2,245,2071
9/3/1995,17000,1995,9,3,246,2072
9/4/1995,16600,1995,9,4,247,2073
9/5/1995,18300,1995,9,5,248,2074
9/6/1995,18200,1995,9,6,249,2075
9/7/1995,18300,1995,9,7,250,2076
9/8/1995,17800,1995,9,8,251,2077
9/9/1995,17300,1995,9,9,252,2078
9/10/1995,17500,1995,9,10,253,2079
9/11/1995,18700,1995,9,11,254,2080
9/12/1995,18300,1995,9,12,255,2081
9/13/1995,18000,1995,9,13,256,2082
9/14/1995,18500,1995,9,14,257,2083
9/15/1995,18000,1995,9,15,258,2084
9/16/1995,18000,1995,9,16,259,2085
9/17/1995,17700,1995,9,17,260,2086
9/18/1995,18200,1995,9,18,261,2087
9/19/1995,18000,1995,9,19,262,2088
9/20/1995,18800,1995,9,20,263,2089
9/21/1995,18900,1995,9,21,264,2090
9/22/1995,18500,1995,9,22,265,2091
9/23/1995,19000,1995,9,23,266,2092
9/24/1995,18700,1995,9,24,267,2093
9/25/1995,18200,1995,9,25,268,2094
9/26/1995,18700,1995,9,26,269,2095
9/27/1995,19700,1995,9,27,270,2096
9/28/1995,18800,1995,9,28,271,2097
9/29/1995,18600,1995,9,29,272,2098
9/30/1995,19000,1995,9,30,273,2099
10/1/1995,17300,1995,10,1,274,2100
10/2/1995,17200,1995,10,2,275,2101
10/3/1995,17200,1995,10,3,276,2102
10/4/1995,16500,1995,10,4,277,2103
10/5/1995,16000,1995,10,5,278,2104
10/6/1995,16400,1995,10,6,279,2105
10/7/1995,14200,1995,10,7,280,2106
10/8/1995,13400,1995,10,8,281,2107
10/9/1995,14800,1995,10,9,282,2108
10/10/1995,15500,1995,10,10,283,2109
10/11/1995,15800,1995,10,11,284,2110
10/12/1995,15400,1995,10,12,285,2111
10/13/1995,15500,1995,10,13,286,2112
10/14/1995,13300,1995,10,14,287,2113
10/15/1995,11900,1995,10,15,288,2114
10/16/1995,14800,1995,10,16,289,2115
10/17/1995,15500,1995,10,17,290,2116
10/18/1995,15900,1995,10,18,291,2117
10/19/1995,16300,1995,10,19,292,2118
10/20/1995,15800,1995,10,20,293,2119
10/21/1995,13100,1995,10,21,294,2120
10/22/1995,12100,1995,10,22,295,2121
10/23/1995,15400,1995,10,23,296,2122
10/24/1995,14300,1995,10,24,297,2123
10/25/1995,14100,1995,10,25,298,2124
10/26/1995,14500,1995,10,26,299,2125
10/27/1995,13700,1995,10,27,300,2126
10/28/1995,12000,1995,10,28,301,2127
10/29/1995,11300,1995,10,29,302,2128
10/30/1995,13800,1995,10,30,303,2129
10/31/1995,14000,1995,10,31,304,2130
11/1/1995,14000,1995,11,1,305,2131
11/2/1995,14300,1995,11,2,306,2132
11/3/1995,15400,1995,11,3,307,2133
11/4/1995,13000,1995,11,4,308,2134
11/5/1995,12900,1995,11,5,309,2135
11/6/1995,15600,1995,11,6,310,2136
11/7/1995,16000,1995,11,7,311,2137
11/8/1995,16500,1995,11,8,312,2138
11/9/1995,15400,1995,11,9,313,2139
11/10/1995,14800,1995,11,10,314,2140
11/11/1995,13300,1995,11,11,315,2141
11/12/1995,12300,1995,11,12,316,2142
11/13/1995,15300,1995,11,13,317,2143
11/14/1995,15200,1995,11,14,318,2144
11/15/1995,14500,1995,11,15,319,2145
11/16/1995,15300,1995,11,16,320,2146
11/17/1995,14700,1995,11,17,321,2147
11/18/1995,12800,1995,11,18,322,2148
11/19/1995,11700,1995,11,19,323,2149
11/20/1995,14800,1995,11,20,324,2150
11/21/1995,14500,1995,11,21,325,2151
11/22/1995,14800,1995,11,22,326,2152
11/23/1995,12400,1995,11,23,327,2153
11/24/1995,13100,1995,11,24,328,2154
11/25/1995,12300,1995,11,25,329,2155
11/26/1995,11200,1995,11,26,330,2156
11/27/1995,15200,1995,11,27,331,2157
11/28/1995,16000,1995,11,28,332,2158
11/29/1995,17600,1995,11,29,333,2159
11/30/1995,16600,1995,11,30,334,2160
12/1/1995,16600,1995,12,1,335,2161
12/2/1995,14300,1995,12,2,336,2162
12/3/1995,12400,1995,12,3,337,2163
12/4/1995,14600,1995,12,4,338,2164
12/5/1995,14000,1995,12,5,339,2165
12/6/1995,15100,1995,12,6,340,2166
12/7/1995,15600,1995,12,7,341,2167
12/8/1995,15400,1995,12,8,342,2168
12/9/1995,13400,1995,12,9,343,2169
12/10/1995,12200,1995,12,10,344,2170
12/11/1995,15100,1995,12,11,345,2171
12/12/1995,15700,1995,12,12,346,2172
12/13/1995,16000,1995,12,13,347,2173
12/14/1995,15400,1995,12,14,348,2174
12/15/1995,16400,1995,12,15,349,2175
12/16/1995,14600,1995,12,16,350,2176
12/17/1995,12600,1995,12,17,351,2177
12/18/1995,15300,1995,12,18,352,2178
12/19/1995,15900,1995,12,19,353,2179
12/20/1995,15900,1995,12,20,354,2180
12/21/1995,15900,1995,12,21,355,2181
12/22/1995,15700,1995,12,22,356,2182
12/23/1995,13600,1995,12,23,357,2183
12/24/1995,13300,1995,12,24,358,2184
12/25/1995,12100,1995,12,25,359,2185
12/26/1995,15000,1995,12,26,360,2186
12/27/1995,15500,1995,12,27,361,2187
12/28/1995,15600,1995,12,28,362,2188
12/29/1995,15500,1995,12,29,363,2189
12/30/1995,14600,1995,12,30,364,2190
12/31/1995,13200,1995,12,31,365,2191
1/1/1996,13000,1996,1,1,1,2192
1/2/1996,16000,1996,1,2,2,2193
1/3/1996,15900,1996,1,3,3,2194
1/4/1996,16500,1996,1,4,4,2195
1/5/1996,16300,1996,1,5,5,2196
1/6/1996,15500,1996,1,6,6,2197
1/7/1996,13300,1996,1,7,7,2198
1/8/1996,15000,1996,1,8,8,2199
1/9/1996,17000,1996,1,9,9,2200
1/10/1996,16400,1996,1,10,10,2201
1/11/1996,16500,1996,1,11,11,2202
1/12/1996,16600,1996,1,12,12,2203
1/13/1996,16400,1996,1,13,13,2204
1/14/1996,13100,1996,1,14,14,2205
1/15/1996,15500,1996,1,15,15,2206
1/16/1996,16200,1996,1,16,16,2207
1/17/1996,17100,1996,1,17,17,2208
1/18/1996,17900,1996,1,18,18,2209
1/19/1996,17200,1996,1,19,19,2210
1/20/1996,16200,1996,1,20,20,2211
1/21/1996,14500,1996,1,21,21,2212
1/22/1996,17000,1996,1,22,22,2213
1/23/1996,17600,1996,1,23,23,2214
1/24/1996,17200,1996,1,24,24,2215
1/25/1996,17400,1996,1,25,25,2216
1/26/1996,16300,1996,1,26,26,2217
1/27/1996,14400,1996,1,27,27,2218
1/28/1996,12500,1996,1,28,28,2219
1/29/1996,15600,1996,1,29,29,2220
1/30/1996,16000,1996,1,30,30,2221
1/31/1996,15400,1996,1,31,31,2222
2/1/1996,16700,1996,2,1,32,2223
2/2/1996,16300,1996,2,2,33,2224
2/3/1996,14200,1996,2,3,34,2225
2/4/1996,12500,1996,2,4,35,2226
2/5/1996,14000,1996,2,5,36,2227
2/6/1996,13800,1996,2,6,37,2228
2/7/1996,13900,1996,2,7,38,2229
2/8/1996,13500,1996,2,8,39,2230
2/9/1996,13100,1996,2,9,40,2231
2/10/1996,12000,1996,2,10,41,2232
2/11/1996,10500,1996,2,11,42,2233
2/12/1996,13400,1996,2,12,43,2234
2/13/1996,14900,1996,2,13,44,2235
2/14/1996,14300,1996,2,14,45,2236
2/15/1996,14300,1996,2,15,46,2237
2/16/1996,15100,1996,2,16,47,2238
2/17/1996,13400,1996,2,17,48,2239
2/18/1996,11600,1996,2,18,49,2240
2/19/1996,15000,1996,2,19,50,2241
2/20/1996,15500,1996,2,20,51,2242
2/21/1996,15100,1996,2,21,52,2243
2/22/1996,15700,1996,2,22,53,2244
2/23/1996,15200,1996,2,23,54,2245
2/24/1996,12800,1996,2,24,55,2246
2/25/1996,12200,1996,2,25,56,2247
2/26/1996,15100,1996,2,26,57,2248
2/27/1996,16700,1996,2,27,58,2249
2/28/1996,16900,1996,2,28,59,2250
2/29/1996,17000,1996,2,29,60,2251
3/1/1996,14900,1996,3,1,61,2252
3/2/1996,12100,1996,3,2,62,2253
3/3/1996,9960,1996,3,3,63,2254
3/4/1996,13300,1996,3,4,64,2255
3/5/1996,13500,1996,3,5,65,2256
3/6/1996,14000,1996,3,6,66,2257
3/7/1996,14400,1996,3,7,67,2258
3/8/1996,13800,1996,3,8,68,2259
3/9/1996,11000,1996,3,9,69,2260
3/10/1996,10300,1996,3,10,70,2261
3/11/1996,14100,1996,3,11,71,2262
3/12/1996,14200,1996,3,12,72,2263
3/13/1996,14200,1996,3,13,73,2264
3/14/1996,14700,1996,3,14,74,2265
3/15/1996,14300,1996,3,15,75,2266
3/16/1996,11700,1996,3,16,76,2267
3/17/1996,10000,1996,3,17,77,2268
3/18/1996,13600,1996,3,18,78,2269
3/19/1996,14200,1996,3,19,79,2270
3/20/1996,14600,1996,3,20,80,2271
3/21/1996,14900,1996,3,21,81,2272
3/22/1996,9060,1996,3,22,82,2273
3/23/1996,8270,1996,3,23,83,2274
3/24/1996,8270,1996,3,24,84,2275
3/25/1996,8260,1996,3,25,85,2276
3/26/1996,32400,1996,3,26,86,2277
3/27/1996,45100,1996,3,27,87,2278
3/28/1996,45300,1996,3,28,88,2279
3/29/1996,45500,1996,3,29,89,2280
3/30/1996,45500,1996,3,30,90,2281
3/31/1996,45600,1996,3,31,91,2282
4/1/1996,45600,1996,4,1,92,2283
4/2/1996,41700,1996,4,2,93,2284
4/3/1996,20600,1996,4,3,94,2285
4/4/1996,9610,1996,4,4,95,2286
4/5/1996,8160,1996,4,5,96,2287
4/6/1996,8150,1996,4,6,97,2288
4/7/1996,8150,1996,4,7,98,2289
4/8/1996,16600,1996,4,8,99,2290
4/9/1996,18700,1996,4,9,100,2291
4/10/1996,18700,1996,4,10,101,2292
4/11/1996,18900,1996,4,11,102,2293
4/12/1996,18900,1996,4,12,103,2294
4/13/1996,18800,1996,4,13,104,2295
4/14/1996,18400,1996,4,14,105,2296
4/15/1996,17900,1996,4,15,106,2297
4/16/1996,17700,1996,4,16,107,2298
4/17/1996,18100,1996,4,17,108,2299
4/18/1996,17900,1996,4,18,109,2300
4/19/1996,18200,1996,4,19,110,2301
4/20/1996,18300,1996,4,20,111,2302
4/21/1996,16500,1996,4,21,112,2303
4/22/1996,18500,1996,4,22,113,2304
4/23/1996,18600,1996,4,23,114,2305
4/24/1996,18700,1996,4,24,115,2306
4/25/1996,18600,1996,4,25,116,2307
4/26/1996,18600,1996,4,26,117,2308
4/27/1996,18200,1996,4,27,118,2309
4/28/1996,16600,1996,4,28,119,2310
4/29/1996,18600,1996,4,29,120,2311
4/30/1996,18600,1996,4,30,121,2312
5/1/1996,18300,1996,5,1,122,2313
5/2/1996,18000,1996,5,2,123,2314
5/3/1996,17900,1996,5,3,124,2315
5/4/1996,17800,1996,5,4,125,2316
5/5/1996,12500,1996,5,5,126,2317
5/6/1996,17600,1996,5,6,127,2318
5/7/1996,18000,1996,5,7,128,2319
5/8/1996,18100,1996,5,8,129,2320
5/9/1996,18000,1996,5,9,130,2321
5/10/1996,17800,1996,5,10,131,2322
5/11/1996,17700,1996,5,11,132,2323
5/12/1996,13200,1996,5,12,133,2324
5/13/1996,17500,1996,5,13,134,2325
5/14/1996,17900,1996,5,14,135,2326
5/15/1996,17800,1996,5,15,136,2327
5/16/1996,17800,1996,5,16,137,2328
5/17/1996,17800,1996,5,17,138,2329
5/18/1996,17500,1996,5,18,139,2330
5/19/1996,13900,1996,5,19,140,2331
5/20/1996,17700,1996,5,20,141,2332
5/21/1996,17800,1996,5,21,142,2333
5/22/1996,17900,1996,5,22,143,2334
5/23/1996,17900,1996,5,23,144,2335
5/24/1996,17800,1996,5,24,145,2336
5/25/1996,16700,1996,5,25,146,2337
5/26/1996,14800,1996,5,26,147,2338
5/27/1996,14300,1996,5,27,148,2339
5/28/1996,16800,1996,5,28,149,2340
5/29/1996,17000,1996,5,29,150,2341
5/30/1996,16800,1996,5,30,151,2342
5/31/1996,17100,1996,5,31,152,2343
6/1/1996,16500,1996,6,1,153,2344
6/2/1996,14100,1996,6,2,154,2345
6/3/1996,17900,1996,6,3,155,2346
6/4/1996,18300,1996,6,4,156,2347
6/5/1996,18300,1996,6,5,157,2348
6/6/1996,18300,1996,6,6,158,2349
6/7/1996,18100,1996,6,7,159,2350
6/8/1996,16900,1996,6,8,160,2351
6/9/1996,15100,1996,6,9,161,2352
6/10/1996,17800,1996,6,10,162,2353
6/11/1996,18800,1996,6,11,163,2354
6/12/1996,18000,1996,6,12,164,2355
6/13/1996,18100,1996,6,13,165,2356
6/14/1996,18100,1996,6,14,166,2357
6/15/1996,17100,1996,6,15,167,2358
6/16/1996,15700,1996,6,16,168,2359
6/17/1996,17900,1996,6,17,169,2360
6/18/1996,18000,1996,6,18,170,2361
6/19/1996,18100,1996,6,19,171,2362
6/20/1996,18300,1996,6,20,172,2363
6/21/1996,17500,1996,6,21,173,2364
6/22/1996,16800,1996,6,22,174,2365
6/23/1996,17300,1996,6,23,175,2366
6/24/1996,17500,1996,6,24,176,2367
6/25/1996,18300,1996,6,25,177,2368
6/26/1996,17900,1996,6,26,178,2369
6/27/1996,17900,1996,6,27,179,2370
6/28/1996,18000,1996,6,28,180,2371
6/29/1996,18100,1996,6,29,181,2372
6/30/1996,18100,1996,6,30,182,2373
7/1/1996,18600,1996,7,1,183,2374
7/2/1996,19600,1996,7,2,184,2375
7/3/1996,19100,1996,7,3,185,2376
7/4/1996,16600,1996,7,4,186,2377
7/5/1996,18200,1996,7,5,187,2378
7/6/1996,16800,1996,7,6,188,2379
7/7/1996,15700,1996,7,7,189,2380
7/8/1996,17000,1996,7,8,190,2381
7/9/1996,18500,1996,7,9,191,2382
7/10/1996,19100,1996,7,10,192,2383
7/11/1996,18800,1996,7,11,193,2384
7/12/1996,18200,1996,7,12,194,2385
7/13/1996,17600,1996,7,13,195,2386
7/14/1996,15300,1996,7,14,196,2387
7/15/1996,17900,1996,7,15,197,2388
7/16/1996,18600,1996,7,16,198,2389
7/17/1996,17000,1996,7,17,199,2390
7/18/1996,15900,1996,7,18,200,2391
7/19/1996,15600,1996,7,19,201,2392
7/20/1996,13700,1996,7,20,202,2393
7/21/1996,12800,1996,7,21,203,2394
7/22/1996,15200,1996,7,22,204,2395
7/23/1996,15300,1996,7,23,205,2396
7/24/1996,14700,1996,7,24,206,2397
7/25/1996,13900,1996,7,25,207,2398
7/26/1996,13600,1996,7,26,208,2399
7/27/1996,11900,1996,7,27,209,2400
7/28/1996,11400,1996,7,28,210,2401
7/29/1996,13800,1996,7,29,211,2402
7/30/1996,13600,1996,7,30,212,2403
7/31/1996,13900,1996,7,31,213,2404
8/1/1996,15100,1996,8,1,214,2405
8/2/1996,15400,1996,8,2,215,2406
8/3/1996,14800,1996,8,3,216,2407
8/4/1996,12200,1996,8,4,217,2408
8/5/1996,15100,1996,8,5,218,2409
8/6/1996,16400,1996,8,6,219,2410
8/7/1996,16000,1996,8,7,220,2411
8/8/1996,15800,1996,8,8,221,2412
8/9/1996,16000,1996,8,9,222,2413
8/10/1996,13800,1996,8,10,223,2414
8/11/1996,14200,1996,8,11,224,2415
8/12/1996,16100,1996,8,12,225,2416
8/13/1996,16100,1996,8,13,226,2417
8/14/1996,16500,1996,8,14,227,2418
8/15/1996,16400,1996,8,15,228,2419
8/16/1996,16800,1996,8,16,229,2420
8/17/1996,14400,1996,8,17,230,2421
8/18/1996,12100,1996,8,18,231,2422
8/19/1996,15600,1996,8,19,232,2423
8/20/1996,15600,1996,8,20,233,2424
8/21/1996,15200,1996,8,21,234,2425
8/22/1996,15100,1996,8,22,235,2426
8/23/1996,15100,1996,8,23,236,2427
8/24/1996,14800,1996,8,24,237,2428
8/25/1996,11500,1996,8,25,238,2429
8/26/1996,15300,1996,8,26,239,2430
8/27/1996,14900,1996,8,27,240,2431
8/28/1996,15100,1996,8,28,241,2432
8/29/1996,14800,1996,8,29,242,2433
8/30/1996,14100,1996,8,30,243,2434
8/31/1996,8830,1996,8,31,244,2435
9/1/1996,8280,1996,9,1,245,2436
9/2/1996,8280,1996,9,2,246,2437
9/3/1996,14400,1996,9,3,247,2438
9/4/1996,15600,1996,9,4,248,2439
9/5/1996,15400,1996,9,5,249,2440
9/6/1996,14900,1996,9,6,250,2441
9/7/1996,13500,1996,9,7,251,2442
9/8/1996,12900,1996,9,8,252,2443
9/9/1996,15100,1996,9,9,253,2444
9/10/1996,15700,1996,9,10,254,2445
9/11/1996,15700,1996,9,11,255,2446
9/12/1996,15500,1996,9,12,256,2447
9/13/1996,14900,1996,9,13,257,2448
9/14/1996,12700,1996,9,14,258,2449
9/15/1996,11000,1996,9,15,259,2450
9/16/1996,13600,1996,9,16,260,2451
9/17/1996,14400,1996,9,17,261,2452
9/18/1996,14600,1996,9,18,262,2453
9/19/1996,14700,1996,9,19,263,2454
9/20/1996,14800,1996,9,20,264,2455
9/21/1996,12900,1996,9,21,265,2456
9/22/1996,12400,1996,9,22,266,2457
9/23/1996,14600,1996,9,23,267,2458
9/24/1996,14900,1996,9,24,268,2459
9/25/1996,15400,1996,9,25,269,2460
9/26/1996,15200,1996,9,26,270,2461
9/27/1996,14600,1996,9,27,271,2462
9/28/1996,13200,1996,9,28,272,2463
9/29/1996,11300,1996,9,29,273,2464
9/30/1996,14200,1996,9,30,274,2465
10/1/1996,13300,1996,10,1,275,2466
10/2/1996,13200,1996,10,2,276,2467
10/3/1996,13800,1996,10,3,277,2468
10/4/1996,13000,1996,10,4,278,2469
10/5/1996,10500,1996,10,5,279,2470
10/6/1996,9400,1996,10,6,280,2471
10/7/1996,12500,1996,10,7,281,2472
10/8/1996,13000,1996,10,8,282,2473
10/9/1996,12900,1996,10,9,283,2474
10/10/1996,12300,1996,10,10,284,2475
10/11/1996,11600,1996,10,11,285,2476
10/12/1996,8800,1996,10,12,286,2477
10/13/1996,8030,1996,10,13,287,2478
10/14/1996,9810,1996,10,14,288,2479
10/15/1996,11000,1996,10,15,289,2480
10/16/1996,11700,1996,10,16,290,2481
10/17/1996,10900,1996,10,17,291,2482
10/18/1996,11100,1996,10,18,292,2483
10/19/1996,8600,1996,10,19,293,2484
10/20/1996,8070,1996,10,20,294,2485
10/21/1996,10600,1996,10,21,295,2486
10/22/1996,10400,1996,10,22,296,2487
10/23/1996,10300,1996,10,23,297,2488
10/24/1996,10500,1996,10,24,298,2489
10/25/1996,10200,1996,10,25,299,2490
10/26/1996,8770,1996,10,26,300,2491
10/27/1996,7950,1996,10,27,301,2492
10/28/1996,10300,1996,10,28,302,2493
10/29/1996,10900,1996,10,29,303,2494
10/30/1996,11500,1996,10,30,304,2495
10/31/1996,11000,1996,10,31,305,2496
11/1/1996,11600,1996,11,1,306,2497
11/2/1996,9880,1996,11,2,307,2498
11/3/1996,8850,1996,11,3,308,2499
11/4/1996,10600,1996,11,4,309,2500
11/5/1996,11200,1996,11,5,310,2501
11/6/1996,11100,1996,11,6,311,2502
11/7/1996,11400,1996,11,7,312,2503
11/8/1996,11200,1996,11,8,313,2504
11/9/1996,9670,1996,11,9,314,2505
11/10/1996,7930,1996,11,10,315,2506
11/11/1996,9720,1996,11,11,316,2507
11/12/1996,10800,1996,11,12,317,2508
11/13/1996,10400,1996,11,13,318,2509
11/14/1996,10700,1996,11,14,319,2510
11/15/1996,10500,1996,11,15,320,2511
11/16/1996,9210,1996,11,16,321,2512
11/17/1996,7780,1996,11,17,322,2513
11/18/1996,9960,1996,11,18,323,2514
11/19/1996,10600,1996,11,19,324,2515
11/20/1996,10200,1996,11,20,325,2516
11/21/1996,11800,1996,11,21,326,2517
11/22/1996,12900,1996,11,22,327,2518
11/23/1996,11100,1996,11,23,328,2519
11/24/1996,8860,1996,11,24,329,2520
11/25/1996,12700,1996,11,25,330,2521
11/26/1996,13500,1996,11,26,331,2522
11/27/1996,13000,1996,11,27,332,2523
11/28/1996,10100,1996,11,28,333,2524
11/29/1996,11900,1996,11,29,334,2525
11/30/1996,10000,1996,11,30,335,2526
12/1/1996,10300,1996,12,1,336,2527
12/2/1996,14200,1996,12,2,337,2528
12/3/1996,16100,1996,12,3,338,2529
12/4/1996,17000,1996,12,4,339,2530
12/5/1996,16900,1996,12,5,340,2531
12/6/1996,16300,1996,12,6,341,2532
12/7/1996,12800,1996,12,7,342,2533
12/8/1996,10400,1996,12,8,343,2534
12/9/1996,15500,1996,12,9,344,2535
12/10/1996,16200,1996,12,10,345,2536
12/11/1996,15900,1996,12,11,346,2537
12/12/1996,16400,1996,12,12,347,2538
12/13/1996,16100,1996,12,13,348,2539
12/14/1996,13000,1996,12,14,349,2540
12/15/1996,11100,1996,12,15,350,2541
12/16/1996,16000,1996,12,16,351,2542
12/17/1996,16700,1996,12,17,352,2543
12/18/1996,16800,1996,12,18,353,2544
12/19/1996,17400,1996,12,19,354,2545
12/20/1996,17000,1996,12,20,355,2546
12/21/1996,13800,1996,12,21,356,2547
12/22/1996,11300,1996,12,22,357,2548
12/23/1996,15900,1996,12,23,358,2549
12/24/1996,15500,1996,12,24,359,2550
12/25/1996,11100,1996,12,25,360,2551
12/26/1996,15200,1996,12,26,361,2552
12/27/1996,15800,1996,12,27,362,2553
12/28/1996,13000,1996,12,28,363,2554
12/29/1996,11400,1996,12,29,364,2555
12/30/1996,15700,1996,12,30,365,2556
12/31/1996,16300,1996,12,31,366,2557
1/1/1997,12500,1997,1,1,1,2558
1/2/1997,16200,1997,1,2,2,2559
1/3/1997,16800,1997,1,3,3,2560
1/4/1997,16600,1997,1,4,4,2561
1/5/1997,14400,1997,1,5,5,2562
1/6/1997,17100,1997,1,6,6,2563
1/7/1997,17600,1997,1,7,7,2564
1/8/1997,17500,1997,1,8,8,2565
1/9/1997,17300,1997,1,9,9,2566
1/10/1997,17500,1997,1,10,10,2567
1/11/1997,17800,1997,1,11,11,2568
1/12/1997,17000,1997,1,12,12,2569
1/13/1997,18600,1997,1,13,13,2570
1/14/1997,18200,1997,1,14,14,2571
1/15/1997,18300,1997,1,15,15,2572
1/16/1997,18100,1997,1,16,16,2573
1/17/1997,18300,1997,1,17,17,2574
1/18/1997,17400,1997,1,18,18,2575
1/19/1997,16800,1997,1,19,19,2576
1/20/1997,18100,1997,1,20,20,2577
1/21/1997,18400,1997,1,21,21,2578
1/22/1997,18300,1997,1,22,22,2579
1/23/1997,18400,1997,1,23,23,2580
1/24/1997,18400,1997,1,24,24,2581
1/25/1997,17500,1997,1,25,25,2582
1/26/1997,16600,1997,1,26,26,2583
1/27/1997,18000,1997,1,27,27,2584
1/28/1997,18200,1997,1,28,28,2585
1/29/1997,18400,1997,1,29,29,2586
1/30/1997,18100,1997,1,30,30,2587
1/31/1997,18300,1997,1,31,31,2588
2/1/1997,19000,1997,2,1,32,2589
2/2/1997,17700,1997,2,2,33,2590
2/3/1997,19200,1997,2,3,34,2591
2/4/1997,19400,1997,2,4,35,2592
2/5/1997,19800,1997,2,5,36,2593
2/6/1997,19600,1997,2,6,37,2594
2/7/1997,19700,1997,2,7,38,2595
2/8/1997,19500,1997,2,8,39,2596
2/9/1997,19000,1997,2,9,40,2597
2/10/1997,19400,1997,2,10,41,2598
2/11/1997,19400,1997,2,11,42,2599
2/12/1997,20000,1997,2,12,43,2600
2/13/1997,20000,1997,2,13,44,2601
2/14/1997,20000,1997,2,14,45,2602
2/15/1997,20000,1997,2,15,46,2603
2/16/1997,20000,1997,2,16,47,2604
2/17/1997,20000,1997,2,17,48,2605
2/18/1997,24400,1997,2,18,49,2606
2/19/1997,26800,1997,2,19,50,2607
2/20/1997,26900,1997,2,20,51,2608
2/21/1997,26800,1997,2,21,52,2609
2/22/1997,26800,1997,2,22,53,2610
2/23/1997,26800,1997,2,23,54,2611
2/24/1997,26800,1997,2,24,55,2612
2/25/1997,26800,1997,2,25,56,2613
2/26/1997,26800,1997,2,26,57,2614
2/27/1997,26900,1997,2,27,58,2615
2/28/1997,26900,1997,2,28,59,2616
3/1/1997,26800,1997,3,1,60,2617
3/2/1997,26900,1997,3,2,61,2618
3/3/1997,26800,1997,3,3,62,2619
3/4/1997,26900,1997,3,4,63,2620
3/5/1997,26900,1997,3,5,64,2621
3/6/1997,26900,1997,3,6,65,2622
3/7/1997,26900,1997,3,7,66,2623
3/8/1997,26900,1997,3,8,67,2624
3/9/1997,26900,1997,3,9,68,2625
3/10/1997,26900,1997,3,10,69,2626
3/11/1997,24600,1997,3,11,70,2627
3/12/1997,23900,1997,3,12,71,2628
3/13/1997,23900,1997,3,13,72,2629
3/14/1997,23900,1997,3,14,73,2630
3/15/1997,23900,1997,3,15,74,2631
3/16/1997,23900,1997,3,16,75,2632
3/17/1997,23900,1997,3,17,76,2633
3/18/1997,23900,1997,3,18,77,2634
3/19/1997,24000,1997,3,19,78,2635
3/20/1997,24000,1997,3,20,79,2636
3/21/1997,24000,1997,3,21,80,2637
3/22/1997,24000,1997,3,22,81,2638
3/23/1997,24000,1997,3,23,82,2639
3/24/1997,24100,1997,3,24,83,2640
3/25/1997,24000,1997,3,25,84,2641
3/26/1997,24000,1997,3,26,85,2642
3/27/1997,24000,1997,3,27,86,2643
3/28/1997,24000,1997,3,28,87,2644
3/29/1997,24000,1997,3,29,88,2645
3/30/1997,24000,1997,3,30,89,2646
3/31/1997,23500,1997,3,31,90,2647
4/1/1997,24000,1997,4,1,91,2648
4/2/1997,24000,1997,4,2,92,2649
4/3/1997,24000,1997,4,3,93,2650
4/4/1997,24000,1997,4,4,94,2651
4/5/1997,24000,1997,4,5,95,2652
4/6/1997,24000,1997,4,6,96,2653
4/7/1997,23900,1997,4,7,97,2654
4/8/1997,24000,1997,4,8,98,2655
4/9/1997,21300,1997,4,9,99,2656
4/10/1997,21100,1997,4,10,100,2657
4/11/1997,21100,1997,4,11,101,2658
4/12/1997,21200,1997,4,12,102,2659
4/13/1997,21100,1997,4,13,103,2660
4/14/1997,21100,1997,4,14,104,2661
4/15/1997,21100,1997,4,15,105,2662
4/16/1997,21200,1997,4,16,106,2663
4/17/1997,21000,1997,4,17,107,2664
4/18/1997,21000,1997,4,18,108,2665
4/19/1997,21200,1997,4,19,109,2666
4/20/1997,21100,1997,4,20,110,2667
4/21/1997,21200,1997,4,21,111,2668
4/22/1997,21200,1997,4,22,112,2669
4/23/1997,21100,1997,4,23,113,2670
4/24/1997,21000,1997,4,24,114,2671
4/25/1997,21100,1997,4,25,115,2672
4/26/1997,21000,1997,4,26,116,2673
4/27/1997,21100,1997,4,27,117,2674
4/28/1997,21400,1997,4,28,118,2675
4/29/1997,21000,1997,4,29,119,2676
4/30/1997,21000,1997,4,30,120,2677
5/1/1997,21200,1997,5,1,121,2678
5/2/1997,21100,1997,5,2,122,2679
5/3/1997,21100,1997,5,3,123,2680
5/4/1997,21100,1997,5,4,124,2681
5/5/1997,21000,1997,5,5,125,2682
5/6/1997,21100,1997,5,6,126,2683
5/7/1997,20900,1997,5,7,127,2684
5/8/1997,21000,1997,5,8,128,2685
5/9/1997,21000,1997,5,9,129,2686
5/10/1997,21000,1997,5,10,130,2687
5/11/1997,21000,1997,5,11,131,2688
5/12/1997,21100,1997,5,12,132,2689
5/13/1997,21000,1997,5,13,133,2690
5/14/1997,21100,1997,5,14,134,2691
5/15/1997,21100,1997,5,15,135,2692
5/16/1997,20900,1997,5,16,136,2693
5/17/1997,21100,1997,5,17,137,2694
5/18/1997,21000,1997,5,18,138,2695
5/19/1997,21100,1997,5,19,139,2696
5/20/1997,21000,1997,5,20,140,2697
5/21/1997,21200,1997,5,21,141,2698
5/22/1997,21000,1997,5,22,142,2699
5/23/1997,20900,1997,5,23,143,2700
5/24/1997,21000,1997,5,24,144,2701
5/25/1997,21100,1997,5,25,145,2702
5/26/1997,20900,1997,5,26,146,2703
5/27/1997,20700,1997,5,27,147,2704
5/28/1997,20700,1997,5,28,148,2705
5/29/1997,20700,1997,5,29,149,2706
5/30/1997,20600,1997,5,30,150,2707
5/31/1997,20600,1997,5,31,151,2708
6/1/1997,20700,1997,6,1,152,2709
6/2/1997,20800,1997,6,2,153,2710
6/3/1997,21300,1997,6,3,154,2711
6/4/1997,21200,1997,6,4,155,2712
6/5/1997,21300,1997,6,5,156,2713
6/6/1997,22700,1997,6,6,157,2714
6/7/1997,24000,1997,6,7,158,2715
6/8/1997,24100,1997,6,8,159,2716
6/9/1997,24200,1997,6,9,160,2717
6/10/1997,24000,1997,6,10,161,2718
6/11/1997,24000,1997,6,11,162,2719
6/12/1997,26600,1997,6,12,163,2720
6/13/1997,26900,1997,6,13,164,2721
6/14/1997,26900,1997,6,14,165,2722
6/15/1997,26900,1997,6,15,166,2723
6/16/1997,26800,1997,6,16,167,2724
6/17/1997,26700,1997,6,17,168,2725
6/18/1997,26700,1997,6,18,169,2726
6/19/1997,26700,1997,6,19,170,2727
6/20/1997,26600,1997,6,20,171,2728
6/21/1997,22300,1997,6,21,172,2729
6/22/1997,26500,1997,6,22,173,2730
6/23/1997,26500,1997,6,23,174,2731
6/24/1997,26400,1997,6,24,175,2732
6/25/1997,26400,1997,6,25,176,2733
6/26/1997,26400,1997,6,26,177,2734
6/27/1997,26400,1997,6,27,178,2735
6/28/1997,26300,1997,6,28,179,2736
6/29/1997,26300,1997,6,29,180,2737
6/30/1997,26300,1997,6,30,181,2738
7/1/1997,26300,1997,7,1,182,2739
7/2/1997,26400,1997,7,2,183,2740
7/3/1997,22200,1997,7,3,184,2741
7/4/1997,20600,1997,7,4,185,2742
7/5/1997,21200,1997,7,5,186,2743
7/6/1997,20900,1997,7,6,187,2744
7/7/1997,21000,1997,7,7,188,2745
7/8/1997,21100,1997,7,8,189,2746
7/9/1997,21100,1997,7,9,190,2747
7/10/1997,21100,1997,7,10,191,2748
7/11/1997,21000,1997,7,11,192,2749
7/12/1997,21200,1997,7,12,193,2750
7/13/1997,21000,1997,7,13,194,2751
7/14/1997,21200,1997,7,14,195,2752
7/15/1997,21100,1997,7,15,196,2753
7/16/1997,21100,1997,7,16,197,2754
7/17/1997,21100,1997,7,17,198,2755
7/18/1997,21400,1997,7,18,199,2756
7/19/1997,21200,1997,7,19,200,2757
7/20/1997,21300,1997,7,20,201,2758
7/21/1997,21200,1997,7,21,202,2759
7/22/1997,21200,1997,7,22,203,2760
7/23/1997,21000,1997,7,23,204,2761
7/24/1997,21100,1997,7,24,205,2762
7/25/1997,21200,1997,7,25,206,2763
7/26/1997,21200,1997,7,26,207,2764
7/27/1997,21300,1997,7,27,208,2765
7/28/1997,21100,1997,7,28,209,2766
7/29/1997,21000,1997,7,29,210,2767
7/30/1997,21400,1997,7,30,211,2768
7/31/1997,21400,1997,7,31,212,2769
8/1/1997,21000,1997,8,1,213,2770
8/2/1997,21100,1997,8,2,214,2771
8/3/1997,21300,1997,8,3,215,2772
8/4/1997,21300,1997,8,4,216,2773
8/5/1997,21100,1997,8,5,217,2774
8/6/1997,21000,1997,8,6,218,2775
8/7/1997,21100,1997,8,7,219,2776
8/8/1997,21300,1997,8,8,220,2777
8/9/1997,21300,1997,8,9,221,2778
8/10/1997,21400,1997,8,10,222,2779
8/11/1997,21400,1997,8,11,223,2780
8/12/1997,21300,1997,8,12,224,2781
8/13/1997,21400,1997,8,13,225,2782
8/14/1997,21300,1997,8,14,226,2783
8/15/1997,21200,1997,8,15,227,2784
8/16/1997,21200,1997,8,16,228,2785
8/17/1997,21000,1997,8,17,229,2786
8/18/1997,20900,1997,8,18,230,2787
8/19/1997,21300,1997,8,19,231,2788
8/20/1997,21200,1997,8,20,232,2789
8/21/1997,21200,1997,8,21,233,2790
8/22/1997,21400,1997,8,22,234,2791
8/23/1997,21500,1997,8,23,235,2792
8/24/1997,21500,1997,8,24,236,2793
8/25/1997,21200,1997,8,25,237,2794
8/26/1997,21100,1997,8,26,238,2795
8/27/1997,21100,1997,8,27,239,2796
8/28/1997,21300,1997,8,28,240,2797
8/29/1997,21300,1997,8,29,241,2798
8/30/1997,11800,1997,8,30,242,2799
8/31/1997,8150,1997,8,31,243,2800
9/1/1997,8110,1997,9,1,244,2801
9/2/1997,15600,1997,9,2,245,2802
9/3/1997,20800,1997,9,3,246,2803
9/4/1997,21000,1997,9,4,247,2804
9/5/1997,21200,1997,9,5,248,2805
9/6/1997,19800,1997,9,6,249,2806
9/7/1997,17700,1997,9,7,250,2807
9/8/1997,20700,1997,9,8,251,2808
9/9/1997,21200,1997,9,9,252,2809
9/10/1997,20800,1997,9,10,253,2810
9/11/1997,21100,1997,9,11,254,2811
9/12/1997,20800,1997,9,12,255,2812
9/13/1997,19700,1997,9,13,256,2813
9/14/1997,17600,1997,9,14,257,2814
9/15/1997,20600,1997,9,15,258,2815
9/16/1997,20500,1997,9,16,259,2816
9/17/1997,19300,1997,9,17,260,2817
9/18/1997,19500,1997,9,18,261,2818
9/19/1997,19800,1997,9,19,262,2819
9/20/1997,19000,1997,9,20,263,2820
9/21/1997,17300,1997,9,21,264,2821
9/22/1997,18900,1997,9,22,265,2822
9/23/1997,19400,1997,9,23,266,2823
9/24/1997,19100,1997,9,24,267,2824
9/25/1997,19200,1997,9,25,268,2825
9/26/1997,19000,1997,9,26,269,2826
9/27/1997,18100,1997,9,27,270,2827
9/28/1997,18300,1997,9,28,271,2828
9/29/1997,19300,1997,9,29,272,2829
9/30/1997,19400,1997,9,30,273,2830
10/1/1997,20000,1997,10,1,274,2831
10/2/1997,19800,1997,10,2,275,2832
10/3/1997,19900,1997,10,3,276,2833
10/4/1997,19500,1997,10,4,277,2834
10/5/1997,16500,1997,10,5,278,2835
10/6/1997,19400,1997,10,6,279,2836
10/7/1997,18600,1997,10,7,280,2837
10/8/1997,17600,1997,10,8,281,2838
10/9/1997,19600,1997,10,9,282,2839
10/10/1997,19700,1997,10,10,283,2840
10/11/1997,18800,1997,10,11,284,2841
10/12/1997,16500,1997,10,12,285,2842
10/13/1997,19500,1997,10,13,286,2843
10/14/1997,19800,1997,10,14,287,2844
10/15/1997,20200,1997,10,15,288,2845
10/16/1997,20000,1997,10,16,289,2846
10/17/1997,20100,1997,10,17,290,2847
10/18/1997,19700,1997,10,18,291,2848
10/19/1997,17000,1997,10,19,292,2849
10/20/1997,19800,1997,10,20,293,2850
10/21/1997,20200,1997,10,21,294,2851
10/22/1997,19900,1997,10,22,295,2852
10/23/1997,19900,1997,10,23,296,2853
10/24/1997,20000,1997,10,24,297,2854
10/25/1997,19500,1997,10,25,298,2855
10/26/1997,18300,1997,10,26,299,2856
10/27/1997,20100,1997,10,27,300,2857
10/28/1997,20900,1997,10,28,301,2858
10/29/1997,20600,1997,10,29,302,2859
10/30/1997,21000,1997,10,30,303,2860
10/31/1997,21000,1997,10,31,304,2861
11/1/1997,19900,1997,11,1,305,2862
11/2/1997,18000,1997,11,2,306,2863
11/3/1997,22700,1997,11,3,307,2864
11/4/1997,30700,1997,11,4,308,2865
11/5/1997,29700,1997,11,5,309,2866
11/6/1997,20600,1997,11,6,310,2867
11/7/1997,20300,1997,11,7,311,2868
11/8/1997,20300,1997,11,8,312,2869
11/9/1997,17600,1997,11,9,313,2870
11/10/1997,20400,1997,11,10,314,2871
11/11/1997,20400,1997,11,11,315,2872
11/12/1997,20200,1997,11,12,316,2873
11/13/1997,20600,1997,11,13,317,2874
11/14/1997,20200,1997,11,14,318,2875
11/15/1997,19600,1997,11,15,319,2876
11/16/1997,17800,1997,11,16,320,2877
11/17/1997,20500,1997,11,17,321,2878
11/18/1997,20300,1997,11,18,322,2879
11/19/1997,19400,1997,11,19,323,2880
11/20/1997,19700,1997,11,20,324,2881
11/21/1997,19700,1997,11,21,325,2882
11/22/1997,17800,1997,11,22,326,2883
11/23/1997,17800,1997,11,23,327,2884
11/24/1997,19600,1997,11,24,328,2885
11/25/1997,19100,1997,11,25,329,2886
11/26/1997,19400,1997,11,26,330,2887
11/27/1997,18100,1997,11,27,331,2888
11/28/1997,18900,1997,11,28,332,2889
11/29/1997,18200,1997,11,29,333,2890
11/30/1997,17800,1997,11,30,334,2891
12/1/1997,19400,1997,12,1,335,2892
12/2/1997,19700,1997,12,2,336,2893
12/3/1997,18900,1997,12,3,337,2894
12/4/1997,19800,1997,12,4,338,2895
12/5/1997,19700,1997,12,5,339,2896
12/6/1997,18900,1997,12,6,340,2897
12/7/1997,17000,1997,12,7,341,2898
12/8/1997,20200,1997,12,8,342,2899
12/9/1997,20000,1997,12,9,343,2900
12/10/1997,20900,1997,12,10,344,2901
12/11/1997,20900,1997,12,11,345,2902
12/12/1997,21000,1997,12,12,346,2903
12/13/1997,20400,1997,12,13,347,2904
12/14/1997,19100,1997,12,14,348,2905
12/15/1997,20700,1997,12,15,349,2906
12/16/1997,21000,1997,12,16,350,2907
12/17/1997,20700,1997,12,17,351,2908
12/18/1997,21100,1997,12,18,352,2909
12/19/1997,20500,1997,12,19,353,2910
12/20/1997,21100,1997,12,20,354,2911
12/21/1997,18800,1997,12,21,355,2912
12/22/1997,20900,1997,12,22,356,2913
12/23/1997,20900,1997,12,23,357,2914
12/24/1997,20900,1997,12,24,358,2915
12/25/1997,19400,1997,12,25,359,2916
12/26/1997,20600,1997,12,26,360,2917
12/27/1997,20900,1997,12,27,361,2918
12/28/1997,18900,1997,12,28,362,2919
12/29/1997,20300,1997,12,29,363,2920
12/30/1997,20600,1997,12,30,364,2921
12/31/1997,20900,1997,12,31,365,2922
1/1/1998,19300,1998,1,1,1,2923
1/2/1998,20000,1998,1,2,2,2924
1/3/1998,19400,1998,1,3,3,2925
1/4/1998,19200,1998,1,4,4,2926
1/5/1998,19800,1998,1,5,5,2927
1/6/1998,20100,1998,1,6,6,2928
1/7/1998,20000,1998,1,7,7,2929
1/8/1998,19600,1998,1,8,8,2930
1/9/1998,19400,1998,1,9,9,2931
1/10/1998,19600,1998,1,10,10,2932
1/11/1998,18800,1998,1,11,11,2933
1/12/1998,19800,1998,1,12,12,2934
1/13/1998,19900,1998,1,13,13,2935
1/14/1998,20000,1998,1,14,14,2936
1/15/1998,19600,1998,1,15,15,2937
1/16/1998,19400,1998,1,16,16,2938
1/17/1998,18100,1998,1,17,17,2939
1/18/1998,19000,1998,1,18,18,2940
